title,adj_num,verb_num,noun_num,adv_num,subreddit,selftext,word_count,neg_sent_score,neutral_sent_score,pos_sent_score,cmpd_sent_score
"Never forget how many people came to help Stephan Bonnar when his House caught fire last April, Tyron Woodley being one of the biggest supporter on his GoFundMe. RIP",3,4,12,1,1,0,29,0.069,0.721,0.21,0.5948
Most of you will cry about this,1,1,0,0,1,0,7,0.341,0.659,0.0,-0.4767
"Need advice, mainly on the mental approach I should take after this situation.",1,2,3,1,0,1,13,0.0,1.0,0.0,0.0
Most wholesome octagon moment?,2,0,2,0,1,1,4,0.0,1.0,0.0,0.0
Damon Jackson: A Win over Dan Ige Get Me in Top 15,0,0,9,0,0,0,12,0.0,0.616,0.384,0.6808
The undefeated Dagestani Sharaputdin Magomedov may soon sign a contract with a major MMA organization. Probably UFC or not?,2,1,9,1,1,0,19,0.0,1.0,0.0,0.0
just dropped today,0,1,1,1,0,0,3,0.0,1.0,0.0,0.0
Bobby Green Rolling With Nasrat Haqparast‘s Punches.,0,1,5,0,0,0,7,0.0,1.0,0.0,0.0
UFC 284,0,0,0,0,0,1,2,0.0,1.0,0.0,0.0
MMA Guru break down Paddy v Gordon. 20 minute of good entertainment,1,1,7,1,1,0,12,0.0,0.637,0.363,0.6908
Rest in peace Stephan Bonnar,0,0,4,0,1,0,5,0.0,0.533,0.467,0.5423
Jeff Molina talked about James Krause mentoring him on how to bet in MMA,0,3,5,0,0,0,14,0.0,1.0,0.0,0.0
What do you guy think of this?🤣,0,3,1,0,1,0,7,0.0,1.0,0.0,0.0
Valentina Shevchenko versus Manon Fiorot???,0,0,5,0,0,0,5,0.0,1.0,0.0,0.0
Boxing to UFC,0,2,0,0,1,1,3,0.0,1.0,0.0,0.0
Future 4-fold (15.1-2.2),2,0,1,0,1,0,3,0.0,1.0,0.0,0.0
Potential McGregor comeback PPV in 2023??,1,0,3,0,1,0,6,0.0,1.0,0.0,0.0
Bruce Buffer make a statement to Joe Rogan,0,1,5,0,1,0,8,0.0,1.0,0.0,0.0
Who will be a bigger asset to UFC in the future?,1,1,3,0,1,0,11,0.0,0.783,0.217,0.3612
"This man's only loss in the UFC wa a last second submission in a fight he wa winning and a draw in a very close title fight, talk about bad luck poor Ankalaev",5,4,10,2,1,0,33,0.332,0.518,0.151,-0.7717
Does Daniel Cormier's Success At Heavyweight(Strikeforce/UFC) supersede his loss(es) to Jon Jones(STEROIDS)?,0,1,8,0,1,0,12,0.0,0.748,0.252,0.5719
$19.85 Running Shoes For Women Mesh Women Sport Shoes,0,1,7,0,0,0,9,0.0,1.0,0.0,0.0
My favorite Bonnar moment. Stephan finish Krzysztof Soszynski after a bloody slugfest and stare the camera in a celebration pose.,2,2,9,0,0,0,20,0.132,0.731,0.137,0.0258
"[Official] General Discussion Thread - December 25, 2022",1,0,4,0,0,0,8,0.0,1.0,0.0,0.0
What distinguishes the Dagestani “smeshfuck” or “wrestlefuck” style from other wrestling/G&amp;P styles?,2,1,5,0,0,0,12,0.0,1.0,0.0,0.0
"MERRY CHRISTMAS, FIGHT FANS!!!",0,0,4,0,1,0,4,0.29,0.223,0.488,0.4168
Looking for fight when cutman pushed finger under nose to awaken fighter in corner after knockdown. Same cutman did it to Alex Pereira.,1,4,10,0,1,0,23,0.103,0.833,0.063,-0.25
Adesanya looking good,1,1,1,0,1,0,3,0.0,0.408,0.592,0.4404
R.I.P. Stephen Bonnar,0,0,3,0,0,0,3,0.0,1.0,0.0,0.0
WOW! IZZO WING CHUN EXPOSED: RACIST MISOGYNIST DISGRACED COP,0,0,9,0,0,0,9,0.494,0.287,0.218,-0.5848
Solid joke. What’s the real reason?,2,0,3,0,1,0,6,0.0,0.513,0.487,0.4215
It’s fighter Secret Santa. Who did you get and what did you get them?,0,5,4,0,0,1,14,0.0,0.89,0.11,0.1531
it’s official guys: mr brian ortega,3,0,3,0,1,0,6,0.0,1.0,0.0,0.0
What's your ONE Championship MMA fight of the year?,0,0,4,0,0,0,9,0.208,0.56,0.232,0.0772
Supreme Champion Starring Stephen Bonnar,0,0,5,0,1,0,5,0.0,0.286,0.714,0.8176
Forrest Griffin vs. Stephan Bonnar; TUF Finale 1,0,0,6,0,1,0,8,0.0,1.0,0.0,0.0
Dana &amp; Lorenzo decide to give Bonnar a UFC contract even though he lost the fight. Rip Stephan Bonnar 🕊️,0,3,11,1,1,0,20,0.224,0.776,0.0,-0.5994
RIZIN 40 Fight Order | December 31,0,0,5,0,0,0,7,0.342,0.658,0.0,-0.3818
Marc Raimondi on Twitter: UFC’s Jeff Molina suspended by Nevada State Athletic Commission,0,1,10,0,1,0,13,0.205,0.795,0.0,-0.4767
UFC San Antonio,0,0,3,0,1,1,3,0.0,1.0,0.0,0.0
Just wanted to share a photo of a legend I got back in May. Now go re-watch all his fight 👊,0,4,6,3,0,0,21,0.136,0.754,0.111,-0.128
Just an awesome regular dude. met him at my gym on a random day and we worked a few set together. I hate that this happened on Christmas eve. #Legend,4,5,6,1,1,0,30,0.113,0.762,0.125,0.1027
SWEET CHIN MUSIC?! #shorts #ufc #mma,0,1,4,0,0,0,6,0.0,0.554,0.446,0.6155
"If Masvidal wasn't robbed in the Iaquinta fight, would he have ended up fighting Khabib for the belt?",0,5,5,1,1,1,18,0.242,0.758,0.0,-0.6249
OG Ngannou Was TERRIFYING 😨 #shorts #ufc #mma,0,1,6,0,0,0,8,0.425,0.575,0.0,-0.6633
Breaking news !!!!,0,1,2,0,1,0,3,0.0,1.0,0.0,0.0
"People will say Jones can’t be in the GOAT convo bc of PEDS, yet include Fedor who fought in an org that encouraged juicing and fixed fights.",0,6,11,1,1,0,27,0.159,0.762,0.079,-0.3612
UFC Fighters 🤝 Guns,0,0,4,0,1,0,4,0.375,0.625,0.0,-0.0516
Instant Triangle Hold 🇧🇷 #shorts #ufc #mma,0,1,5,0,0,0,7,0.0,1.0,0.0,0.0
RIP to a real OG,1,0,2,0,0,0,5,0.0,1.0,0.0,0.0
Michael Bisping’s Son Trolls Him With One-Eyed Gingerbread Man,0,0,8,0,0,0,9,0.0,1.0,0.0,0.0
"Stephan Bonnar, UFC Hall of Famer, dead at 45 of complication from a presumed heart issue",1,1,8,0,0,0,16,0.235,0.765,0.0,-0.6486
The best ONE Championship Knockouts of 2022,1,0,2,0,0,0,7,0.0,0.413,0.587,0.7964
Which fighter did you feel worse for after a loss?,2,2,2,0,1,1,10,0.415,0.462,0.123,-0.5859
RIP Stefan Bonner,0,0,3,0,0,1,3,0.0,1.0,0.0,0.0
Who should Jack Della Maddalena fight in Perth?,0,0,5,0,0,0,8,0.271,0.729,0.0,-0.3818
MMA legend Stephan Bonnar dead at 45 - RIP Stephan,0,2,5,0,0,0,10,0.35,0.65,0.0,-0.6486
"I have this hanging in my gym a motivation. I wa in college watching this fight and have been a fan of his ever since. Rip, he wa a huge reason for the UFC's success.",1,6,11,1,1,0,35,0.076,0.655,0.27,0.7717
"Bonnar, fought in landmark UFC bout, dy at 45",0,0,6,0,0,0,9,0.217,0.66,0.123,-0.25
Best to never hold a belt?,1,1,1,1,1,0,6,0.0,0.488,0.512,0.6369
Stephan Bonnar responds to Paddy Pimblett on past Photo rejection,1,1,6,0,1,0,10,0.28,0.72,0.0,-0.5423
"Legend of MMA and TUF season 1 finalist Stephan Bonnar ha unfortunately passed away at the age of 45, Rest In Peace.",0,2,10,2,1,0,22,0.096,0.763,0.141,0.2732
"Looking to get into watching ufc, whats the best way",2,3,2,0,1,0,10,0.0,0.682,0.318,0.6369
What are the chance that Kadyrov is giving Khamzat super physiological juice so he can be the first Chechen champ,3,4,6,0,1,0,20,0.0,0.588,0.412,0.8807
Throwback to when Islam Makhachev called out Michael Chandler,0,1,5,1,1,0,9,0.0,1.0,0.0,0.0
"Rip to one of the 2 men that saved the UFC, really suck no one helped you in time",0,3,5,1,1,0,19,0.228,0.65,0.121,-0.3551
Stephan Bonnar ha passed away,0,2,2,1,1,0,5,0.0,1.0,0.0,0.0
I think this one could be a straight banger. How do you see it playing out?,1,5,2,1,1,0,16,0.0,0.764,0.236,0.4019
RIP TO AN ABSOLUTE LEGEND! Gone way too soon,0,0,7,2,1,0,9,0.0,1.0,0.0,0.0
Stephan bonnar pass away,0,1,2,1,0,0,4,0.0,1.0,0.0,0.0
UFC’s Facebook is reporting the Stephan Bonner passed away,0,3,4,1,1,0,9,0.0,1.0,0.0,0.0
Sad day,0,0,2,0,1,0,2,0.756,0.244,0.0,-0.4767
UFC Hall of Famer and pioneer of the sport Stephan Bonnar ha passed away.,0,2,8,0,0,0,14,0.0,1.0,0.0,0.0
Stephan Bonnar ha passed 🕊️ via UFC,0,2,4,0,1,0,7,0.0,1.0,0.0,0.0
RIP UFC Hall of Famer Stephan Bonnar,0,0,6,0,0,0,7,0.0,1.0,0.0,0.0
Stephan Bonnar ha died,0,2,2,0,0,0,4,0.545,0.455,0.0,-0.5574
"UFC on Instagram: ""The UFC family is saddened by the passing of UFC Hall of Famer Stephan Bonnar. We send our sincerest condolence to his family and friends.""",0,3,15,0,0,0,28,0.105,0.802,0.093,-0.1027
Lando Vannata detail how he thwarted a home invasion in Albuquerque,0,1,6,0,0,0,11,0.109,0.891,0.0,-0.0258
champ at end of 2023 predictions?,0,0,3,0,1,0,6,0.0,0.641,0.359,0.4215
Yeah it’s over for Francis 💀,0,0,3,0,1,0,6,0.0,0.645,0.355,0.296
Yeah after rewatching this fight I’m about 98% sure Jon smash Francis,1,2,5,0,1,0,12,0.182,0.545,0.273,0.128
"Free Fight: BJ Penn v Matt Hughes | UFC 46, 2004 | UFC",1,0,10,0,0,0,13,0.174,0.604,0.221,0.1779
Big John's Top Submissions of 2022,1,0,3,0,0,0,6,0.0,0.735,0.265,0.2023
Hot take: Aljamain sterling is getting the same hate how Tyron woodley wa when he wa the champ? the fan hate him even his own bos,2,5,10,1,1,0,26,0.221,0.687,0.093,-0.6486
This is definitely a prank meant to stir thing up in r/ufc 😂,0,2,5,2,1,0,13,0.0,0.787,0.213,0.4019
Do you think someone will ever hold 3 belt at the same time?,1,3,3,1,1,0,13,0.0,1.0,0.0,0.0
"You are reborn a a UFC fighter's child - who would you want a your dad, and who would you hate/not get along with?",0,5,5,0,1,1,24,0.0,0.942,0.058,0.0772
Best Or Worst UFC Posters? For Me This One Is The Best Because I Got A Physical One With The MMA Board Game,2,2,9,0,1,0,23,0.134,0.59,0.275,0.6486
UFC Year In Review - 2022 | PART 1,1,0,4,0,0,0,9,0.0,1.0,0.0,0.0
Why do you love ufc?,1,2,0,0,1,0,5,0.0,0.488,0.512,0.6369
Chandler think Volkanovski will squeak out a decision victory against Islam!,0,2,5,1,0,0,11,0.0,1.0,0.0,0.0
Is Henry Cejudo trying to Dennis system the UFC?,0,2,5,0,0,1,9,0.0,1.0,0.0,0.0
That Chin,0,0,1,0,1,0,2,0.0,1.0,0.0,0.0
Which growing league doe the community think have potential? Seems like there a tiny opportunity for someone else to step up.,3,7,5,1,0,1,21,0.0,0.708,0.292,0.7184
UFC 287 Fight Poster,0,0,2,0,1,0,4,0.464,0.536,0.0,-0.3818
Sherdog’s 2022 Comeback Fighter of the Year is Rob Wilkinson!,1,1,5,0,0,0,10,0.288,0.593,0.119,-0.5093
YOU DON’T WANNA MISS THIS LINK BELOW🚨 #MMA #UFC,0,0,9,0,0,1,9,0.167,0.833,0.0,-0.1531
The 2 undefeated GOATs of the sport,1,0,2,0,1,0,7,0.0,1.0,0.0,0.0
Why doe this division even exist? Women's 145lbs should be cut to make way for a woman's 105lbs division,0,5,5,1,1,0,19,0.11,0.89,0.0,-0.2732
Chito going all the way in on Aljo.,0,1,3,0,0,0,8,0.0,1.0,0.0,0.0
Jon Jones Last Minute Christmas Gift,1,0,5,0,1,0,6,0.0,0.633,0.367,0.4404
"The r/mma community always get me, Thank for all the clips, analysis, AMAs, memes, shit posts, pasta and all-round entertainment during fight nights. Merry Christmas 🎄",4,2,13,1,0,0,26,0.177,0.571,0.251,0.3818
Sign these 2 guy Dana……rematch would be Fight of the Year,0,1,5,0,1,0,11,0.224,0.776,0.0,-0.3818
Aljo to 145 confirmed,0,0,2,0,1,0,4,0.0,1.0,0.0,0.0
Aljo confirms he will move up to 145 if he beat henry,0,3,1,2,0,0,12,0.0,1.0,0.0,0.0
Stoppage,0,0,1,0,1,0,1,0.0,1.0,0.0,0.0
"@AnikFlorianPod: Canadien Tuxedo @kennyFlorian talk Arman Tsarukyan on the latest ""Anik &amp; Florian Podcast"" https://t.co/V4h3IrguiV https://t.co/LyTjyODuMf",3,0,11,0,1,0,16,0.0,1.0,0.0,0.0
"""UFC"" Troll get slapped by UFC Legend Jake Shields - Ep. 4",1,2,6,0,1,0,12,0.0,1.0,0.0,0.0
UFC when I watch with my family.,0,1,1,0,1,0,7,0.0,1.0,0.0,0.0
"One year ago in Poland, a freak fighter died after a slapping tournament",1,1,5,1,1,0,13,0.404,0.497,0.099,-0.7096
:(,0,0,1,0,1,0,1,1.0,0.0,0.0,-0.4404
The UFC-Kadyrov Connection,1,0,1,0,0,1,3,0.0,1.0,0.0,0.0
Pimblett's Next Opponent,0,0,3,0,1,0,3,0.0,1.0,0.0,0.0
Same day weigh in,1,1,2,0,1,0,4,0.0,1.0,0.0,0.0
Colby taunting a virgin cat,0,1,3,0,1,0,5,0.0,1.0,0.0,0.0
"Every top 15 fight UFC should do next in my awful opinion, excluding woman because I got bored.",4,3,3,1,1,0,18,0.342,0.578,0.08,-0.7096
Jon Anik give his thought on Dustin Poirier a a fighter,0,1,6,0,0,0,11,0.0,0.849,0.151,0.1531
New Image of Bryce Mitchell after his fight with Ilia Topuria,0,0,7,0,1,0,11,0.206,0.794,0.0,-0.3818
Dana white act like he doesn’t give a shit what people think meanwhile he literally block people that comment something he doesn’t like. I commented under one of his giveaway post that “paddy’s gonna win all these giveaways” then next thing you know I get blocked.,4,10,12,2,1,0,46,0.142,0.693,0.165,0.296
"@AnikFlorianPod: Ep. 377 – @Jon_Anik &amp; @kennyflorian's Holiday Special with Santa @raylongomma! We sit down for the final show of 2022 to talk about the world of MMA, including judging at #UFCVEGAS66 and more UFC Judging talk. https://t.co/V4h3IrguiV https://t.co/EFJiq4qJ8F",2,4,19,1,1,0,39,0.0,0.863,0.137,0.69
Mark Zuckerberg buying out Fight Night “is the stupidest ducking thing I’ve ever heard.” Dana White. Add to the reason UFC is going down bill.,2,5,12,3,1,0,25,0.207,0.793,0.0,-0.7184
"Israel Adesanya working grappling for Alex Pereira rematch: ""I'm tough too""",1,2,7,0,1,0,11,0.13,0.87,0.0,-0.128
"Prime woodley v prime colby, who wins?",1,1,4,0,1,0,7,0.0,0.619,0.381,0.5719
Jon Anik say Dustin Poirier doesn’t need an Undisputed UFC Lightweight Title to prove his greatness,1,3,8,0,1,0,16,0.0,1.0,0.0,0.0
Can Amanda Nunes become the first triple champ by moving down to flyweight and beating Shevchenko?,1,4,5,1,1,0,16,0.149,0.697,0.154,0.0258
Was this the Fight that ended the myth of Kameru Usman being a boring Champion? Because i recall that being always said before it.,0,5,9,1,1,0,24,0.176,0.683,0.14,-0.0
let get this fight made. who win out these two welterweights?,0,2,4,1,1,0,11,0.191,0.573,0.236,0.1779
I'd like to see these two fight. i say li jingliang win,1,2,5,0,1,1,12,0.155,0.476,0.369,0.5574
Prime Khabib v current Islam. Who would win and why?,1,2,4,0,1,0,10,0.0,0.703,0.297,0.5859
"If these two were to fight, who would win and why?",0,4,0,0,1,0,11,0.169,0.584,0.247,0.296
Who do you think win it If this fight ever happens?,0,3,2,1,1,0,11,0.191,0.573,0.236,0.1779
How would this fight play out and who do you have winning it?,0,4,2,1,1,0,13,0.16,0.532,0.309,0.4215
The currently ranked Redditorweights and their win over each other,1,1,2,1,0,0,10,0.0,0.709,0.291,0.5719
Donald “out of the testing pool” Cerrone with some amazing head growth,1,1,6,0,1,0,12,0.0,0.61,0.39,0.7506
Need help Understanding how damage is scored in a fight,0,2,5,0,0,0,10,0.4,0.414,0.186,-0.4767
"Volk on his way to Mahatchkala to infiltrate Islam’s gym. “No one will ever suspect a thing, mate, no worries!”",0,2,9,1,0,0,20,0.216,0.784,0.0,-0.5707
Two high level fighter sparring,1,1,2,0,0,0,5,0.231,0.769,0.0,-0.0516
What UFC fighter could escape that mount at the end? I can’t name any,0,2,4,1,1,0,14,0.0,0.769,0.231,0.3182
we need to have an honest discussion pertaining to the Zion Clark . .,1,3,3,0,0,0,14,0.0,0.769,0.231,0.5106
Final round stand up or grappling only,0,2,2,2,1,0,7,0.0,1.0,0.0,0.0
"we need to have an honest discussion pertaining to this Zion Clark ""miracle""",1,3,4,0,1,0,13,0.0,0.784,0.216,0.5106
Dana White credit cocaine for UFC's ESPN windfall,0,0,7,0,0,0,8,0.0,0.737,0.263,0.3612
Dana White credit cocaine scandal for UFC's ESPN windfall,0,0,8,0,0,0,9,0.234,0.565,0.202,-0.1027
How far do you see his career going in the UFC?,0,3,2,1,1,0,11,0.0,1.0,0.0,0.0
How to make MMA better... Suggestions?,0,1,3,0,1,0,6,0.0,1.0,0.0,0.0
"UFC veteran Cowboy Cerrone stuns fan with TRT physique, look refreshed",0,4,6,0,0,0,11,0.0,0.901,0.099,0.0258
"Ali Kadyrov make his MMA debut against Islam Akbarov, in a farce of a fight for a promotion owned by his father. The teenager also had UFC star Khamzat Chimaev in his corner.",0,3,16,1,0,0,33,0.159,0.841,0.0,-0.6486
"Ali Kadyrov make his MMA debut against Islam Akbarov, in a farce of a fight for a promotion owned by his dictator father.",0,2,11,0,0,0,23,0.227,0.773,0.0,-0.6486
"What are your thought on MMA Guru and his ""beef"" with Dan Hardy and Goddard?",0,1,7,0,1,0,15,0.0,0.838,0.162,0.4019
What do you guy think about my edit of my favourite comeback of this year? And do you agree or disagree?,1,6,3,0,1,0,21,0.121,0.777,0.102,-0.1179
@AnikFlorianPod: From EP.377 of “The Anik &amp; Florian Podcast - YouTube - Apple Podcasts - Spotify - https://t.co/6WILcAA5Br - Promo Code: “TWEET” for Merch Discount https://t.co/V4h3IqYSUl https://t.co/uFMy0YMGkw,0,1,18,0,1,0,27,0.0,1.0,0.0,0.0
question,0,0,1,0,1,0,1,0.0,1.0,0.0,0.0
BJJ fun.,0,0,2,0,0,0,2,0.0,0.233,0.767,0.5106
I'd take Geodude over Zion Clark,0,1,4,0,1,0,6,0.0,1.0,0.0,0.0
UFC UFC yeah!,0,0,3,0,1,0,3,0.0,0.445,0.555,0.3595
Daniel Cormier advises Sean O’Malley not to fight Merab Dvalishvili,0,2,6,1,0,0,10,0.0,0.805,0.195,0.2924
"Barefoot, gun-wielding UFC fighter thwart attempted home invasion in Albuquerque",1,1,7,0,0,0,10,0.127,0.727,0.145,0.0516
losing interest in the UFC,0,1,2,0,1,0,5,0.302,0.349,0.349,0.1027
Islam Makachev street experience.,0,0,4,0,1,0,4,0.0,1.0,0.0,0.0
How did you guy score the Chimaev Burns fight? Here's my analysis:,0,3,5,0,1,0,12,0.191,0.809,0.0,-0.3818
Paddy weighed 169.1lb one week out from his fight,0,1,3,0,1,0,9,0.245,0.755,0.0,-0.3818
Geoff Neal left out of UFC game,0,1,4,1,1,0,7,0.0,1.0,0.0,0.0
Best and worst mma channel on YouTube?,1,0,4,0,1,0,7,0.308,0.376,0.316,0.0258
"If I start MMA training at 16, could I make it to the UFC?",0,2,3,0,0,0,14,0.0,1.0,0.0,0.0
"O’Malley fans, why don’t you count his loss to Chito?",0,2,4,0,1,0,10,0.204,0.796,0.0,-0.3182
two line for lil miguel,0,0,3,0,1,0,5,0.0,1.0,0.0,0.0
Fight pay question,0,0,3,0,1,0,3,0.8,0.2,0.0,-0.4588
Dustin Poirier got his deviated septum fixed,1,2,3,0,1,0,7,0.0,1.0,0.0,0.0
Who would win in a fight between a light heavyweight (~215 lbs) Volkanovski and a welterweight (~170 lbs) Ngannou?,2,1,8,0,1,0,19,0.127,0.686,0.186,0.296
Geoff Neal say Shavkat Rakhmonov will be an ‘easy’ win at UFC Fight Night 217,1,2,8,0,0,0,15,0.134,0.67,0.196,0.296
Aljamain Sterling say he will move up to featherweight after the Henry Cejudo fight in order to give his teammate Merab Dvalishvili a chance to compete for the bantamweight title,0,5,12,1,0,0,30,0.082,0.854,0.063,-0.1531
"[Official] General Discussion Thread - December 24, 2022",1,0,4,0,0,0,8,0.0,1.0,0.0,0.0
Jared Cannonier is willing to step in for Paulo Costa to fight Robert Whittaker in Perth at UFC 284,1,4,7,0,0,0,19,0.126,0.874,0.0,-0.3818
I've been doing wrestling for a while now but I'm looking for a workout I can do at home without weight to help with wrestling and other martial arts.,2,6,8,1,0,1,29,0.104,0.896,0.0,-0.438
"MMA Junkie interview Manon Fiorot: Headlining in next fight, Rose Namajunas rumor",1,0,10,0,0,0,12,0.191,0.809,0.0,-0.3818
José Aldo to fight at Hardcore tournament in Dubai in March,0,1,6,0,0,0,11,0.206,0.794,0.0,-0.3818
Late night mma thought - who would have liked to have seen Shane Carwin have a longer career?,1,5,6,1,0,0,18,0.0,0.843,0.157,0.4215
Why are Whittaker and Costa a prelim fight?,0,1,4,0,1,0,8,0.302,0.698,0.0,-0.3818
Cowboy JDS dancing to soulja boy,0,2,3,0,1,0,6,0.0,1.0,0.0,0.0
"Hi friends! Do you know of a site, page or link where I can watch old UFC fights?",2,2,7,0,1,0,18,0.134,0.697,0.169,0.1759
McTapper will only come back for one fight,0,1,2,2,1,0,8,0.271,0.729,0.0,-0.3818
Is Muay Thai still the strongest martial art in the world...? (with the inclusion of a take down defense and offence in it scoring system similar to Sanda would the Thais return to best in the world?),3,4,13,2,0,0,37,0.051,0.741,0.208,0.7757
"If you could choose your own personal top 5 ever, new age or old, who do you got?",4,3,3,0,1,0,18,0.0,0.899,0.101,0.2023
Most of u,1,0,0,0,1,0,3,0.0,1.0,0.0,0.0
"I know everyone's talking about Dariush v Charles, but who else would you be interested in seeing Do Bronx matched up with?",0,6,6,3,1,0,22,0.0,0.849,0.151,0.5499
"I know everyone's talking about Dariush v Charles, but who else would you be interested in seeing Do Bronx matched up against?",0,6,6,3,1,0,22,0.0,0.849,0.151,0.5499
Champions at End of 2021 v End of 2022. Who Will Be the 12 Belt Holders This Time Next Year?,1,1,8,0,1,0,20,0.0,0.848,0.152,0.5267
Rose Namajunas vs. Gillian Robertson headline FURYPro6 on December 30th in a grappling match,0,0,9,0,0,0,14,0.0,1.0,0.0,0.0
How do you see this one playing out?,0,2,2,0,1,0,8,0.0,0.795,0.205,0.2023
Jake Paul beef with Paddy Pimblett,0,0,5,0,0,0,6,0.0,1.0,0.0,0.0
Is this legit? Conor is fighting a 43 year old?,1,3,3,0,1,0,10,0.263,0.737,0.0,-0.4329
My 2023 lightweight lineup what are yours?,2,1,1,0,1,0,7,0.0,1.0,0.0,0.0
All ufc event 2022 tier list,2,0,2,0,1,0,6,0.0,1.0,0.0,0.0
Petition to change Sean O’Malleys stage name to “Lil Dickie”,0,2,6,0,1,0,10,0.0,1.0,0.0,0.0
"@AnikFlorianPod: RT @theUG: Ok, who win in a game of Khabib Basketball? @bullyb170 or @dc_mma ? 🏀 https://t.co/9ERshyatPU",1,2,8,0,1,0,18,0.0,0.675,0.325,0.7399
What UFC fighter ha competed at the largest gap in weight in their career?,1,2,5,0,1,0,14,0.0,0.89,0.11,0.1531
Sandhagen v Vera: the APEX issue,0,0,5,0,0,1,6,0.0,1.0,0.0,0.0
6 year ago when volk wa considered a wrestler with an overhand. A little training compilation,1,2,6,1,1,0,16,0.0,1.0,0.0,0.0
San Hagen v Chito: the APEX issue,0,0,6,0,0,1,7,0.0,1.0,0.0,0.0
Is This The Most Personal Rivalry In MMA History?,0,1,5,0,1,0,9,0.0,1.0,0.0,0.0
Who else fought a highly ranked opponent in their debut and though may not have won looked like they had the skill to contend but not never became elite?,2,7,4,5,1,0,29,0.12,0.787,0.093,-0.202
Makhachev intense training camp for Volk fight in Perth,1,0,6,0,1,0,9,0.239,0.642,0.119,-0.3182
Describe him in four word,0,0,2,0,1,0,5,0.0,1.0,0.0,0.0
Anyone got some juicy Merab onlyfans pics? 🤤,1,2,4,0,1,0,8,0.0,1.0,0.0,0.0
Still find this performance absolutely incredible. Beneil completely nullified everything Gamrot threw at him. So relaxed.,1,3,7,3,1,0,16,0.0,0.811,0.189,0.5413
Yo Cowboy lookin yoked,0,1,3,0,1,0,4,0.0,1.0,0.0,0.0
What is better to combine with mma?,1,2,1,0,0,1,7,0.0,0.674,0.326,0.4404
Chuck Liddell's Championship Reign,0,0,4,0,0,0,4,0.0,0.508,0.492,0.4404
(OC) Alex Caceres Drawing. Had to after his headkick KO last week.,1,0,8,0,1,0,12,0.0,1.0,0.0,0.0
"If Alex moved up to LHW and won that belt fast, he should try moving up and see if he can knockout more dense chin like Curtis Blaydes. Blaydes ha been chin knocked out before.",2,10,9,3,1,0,35,0.0,0.836,0.164,0.7553
learning mma,0,1,1,0,0,1,2,0.0,1.0,0.0,0.0
"[SPOILER] Ali Kadyrov (teenage son of Chechen dictator, Ramzan Kadyrov) make his MMA debut at ACA 150",2,1,10,0,0,0,17,0.0,1.0,0.0,0.0
When you put it that way,0,1,1,0,1,0,6,0.0,1.0,0.0,0.0
Does Jon Jones need to bulk to win at HW?,0,2,4,0,0,1,10,0.0,0.703,0.297,0.5859
Are you guy bombarded with Conor post suggestion on Facebook and Google? It's annoying. I'm not a fan. How do I stop this?,0,3,12,1,1,0,23,0.286,0.714,0.0,-0.7369
Side by side there’s a clear winner. She deserved it. Get over it losers.,2,2,5,0,1,0,14,0.172,0.505,0.323,0.4588
Lucas Bisping is a savage,0,1,3,0,1,0,5,0.5,0.5,0.0,-0.4588
@AnikFlorianPod: RT @kennyflorian: Never done triple-denim. I’m a mere Duke. “Duke of Denim”. https://t.co/O9pAMJUsNb,2,1,9,0,1,0,14,0.0,1.0,0.0,0.0
Ethereum Names Services Organize Airdrop Of Tokens ($ENS) Worth Up To 10000$ For The First 100 People To Claim Them,1,1,11,0,0,1,20,0.0,0.909,0.091,0.2263
Out of all these. which fight is most likely to happen in 2023?,1,2,2,1,1,0,13,0.178,0.822,0.0,-0.3818
He ain't making 170 ever again,0,2,0,2,1,0,6,0.0,1.0,0.0,0.0
Who would win?,0,1,0,0,1,0,3,0.0,0.345,0.655,0.5859
"‘I want a belt’ — Zion Clark, wrestler without legs, vow to become MMA champ",1,2,9,0,0,0,15,0.0,0.714,0.286,0.5267
Wandy and Andy,0,0,2,0,1,0,3,0.0,1.0,0.0,0.0
"If Alex beat Izzy in the rematch, do you think we might see Usman at MW? If so, how doe this fight go?",1,5,7,0,1,0,23,0.132,0.868,0.0,-0.5204
Cannonier say ‘hell yeah’ to rematch with Whittaker in Australia,0,2,5,0,0,0,10,0.0,1.0,0.0,0.0
Kadyrov’s son win pro MMA debut in farcical fight,2,1,5,0,0,0,9,0.195,0.526,0.278,0.2732
"The fact people will swear up and down GSP wa clean, just show you how much favoritism play into opinion on this sub",1,4,7,3,1,0,23,0.045,0.714,0.241,0.6369
Khamzat - Age 28; Cody - Age 31: Ali Kadyrov - Age 30,0,0,4,0,1,0,13,0.0,1.0,0.0,0.0
Hill promised to knockout Alex if he met him in Octagon at LHW,0,3,4,0,1,0,13,0.0,0.828,0.172,0.3612
Conor just want his friend back,0,1,2,2,0,0,6,0.0,0.61,0.39,0.4939
my ufc striking tier list. gimme feedback because some fighter ik more about than others. Jan being S tier bother me tho lol.,3,4,10,0,1,0,23,0.121,0.766,0.113,0.2023
Pereira Food (Heavy Hands #450),0,0,5,0,0,0,5,0.0,1.0,0.0,0.0
Conor really want Artem to stop!,0,2,2,1,1,0,6,0.333,0.667,0.0,-0.3595
[SPOILER] ACA 150: Ali Kadyrov vs. Islam Akbarov,1,0,5,0,0,0,8,0.0,1.0,0.0,0.0
[SPOILER] ACA 150: Eli Kadyrov vs. Islam Akbarov,1,0,5,0,0,1,8,0.0,1.0,0.0,0.0
[SPOILER] ACA 150: Andrey Koshkin vs. Artem Reznikov | ACA LW Grand Prix Semifinal,1,0,11,0,0,0,14,0.0,0.8,0.2,0.4588
From MMAJunkie article regarding Covington and Masvidal assault. Of course Colby stayed in character for the police,0,2,9,0,1,0,17,0.192,0.808,0.0,-0.5859
How long would it take to watch every single ufc in order?,1,2,2,1,1,0,12,0.0,1.0,0.0,0.0
Khamzat's last 3 IG post are all about Kadyrov 's son - he's gone,1,2,6,0,1,0,14,0.0,1.0,0.0,0.0
Khamzat's last three IG post are all about Kadyrov's son - he's gone,1,2,6,0,1,0,13,0.0,1.0,0.0,0.0
Chito v Sandhagen wa just announced. Are these 2 next for each other?,0,2,6,1,1,0,13,0.0,1.0,0.0,0.0
Could Lebron james KNOCKOUT Mike Tyson?!,0,1,5,0,0,1,6,0.0,1.0,0.0,0.0
"After winning a fight, I've heard a lot of fighter first word on the mic are ""All glory to god, without god this wouldn't be possible...""",3,5,9,0,1,0,26,0.116,0.547,0.337,0.8074
OKTAGON MMA to launch 16-man welterweight tournament in March,2,1,4,0,0,0,9,0.0,1.0,0.0,0.0
How many Pro MMA Fighters had multiple Fights on one day?,2,1,5,0,0,0,11,0.302,0.698,0.0,-0.4404
Colby Covington audio from police conversation following alleged Jorge Masvidal assault released: ‘I saw star a little bit’,2,4,10,0,0,0,18,0.192,0.808,0.0,-0.5859
@AnikFlorianPod: PATRIOTS CHOKE: @Jon_anik and Jason Anik (@bostonAnik) on WORST NFL PLAY EVER | Anik Squared NFL Week 16 Picks https://t.co/BmVRzJi2v0 https://t.co/MuGi2vC5om,1,0,18,0,1,0,22,0.3,0.596,0.104,-0.7865
What would've happened if these two fought?,0,1,2,0,1,0,7,0.277,0.723,0.0,-0.3182
