title,adj_num,verb_num,noun_num,adv_num,subreddit,selftext,word_count,neg_sent_score,neutral_sent_score,pos_sent_score,cmpd_sent_score
UFC Fight Pass Streaming Quality,0,0,5,0,1,0,5,0.394,0.606,0.0,-0.3818
"Will UFC 284 sell 1,000,000 PPVs?",0,1,2,0,1,0,6,0.0,1.0,0.0,0.0
"The ONE Championship team and CEO Chatri Sityodtong comment on the passing of their rising star, Victoria Lee",0,0,12,0,0,0,18,0.0,0.854,0.146,0.4404
Yoel look tiny,1,1,1,0,1,0,3,0.0,1.0,0.0,0.0
Who is your favorite prospect going into 2023?,1,2,1,0,1,0,8,0.0,0.536,0.464,0.6369
Thiago Moises vs. Melk Costa in the work for UFC 283,0,0,6,0,0,0,11,0.0,1.0,0.0,0.0
[Raimondi] 'Do you know how to put on a samurai suit?': Inside the ambitious Bellator-Rizin crossover in Japan,1,2,6,0,0,0,18,0.0,0.838,0.162,0.4767
anybody else experience involuntary full body buzzing around when put in a tight blood choke?,4,2,5,1,0,1,15,0.212,0.788,0.0,-0.5423
I love weasel but how the shit did it feel like hair win against Holloway? he got a clinic put on him.,1,5,5,1,1,0,22,0.0,0.492,0.508,0.9555
"Emerging MMA star Victoria Lee dead aged 18 a family pay tribute to ""beautiful soul",1,2,8,1,0,0,15,0.264,0.556,0.181,-0.2023
Joe Rogan PIZZA!,0,0,3,0,1,0,3,0.0,1.0,0.0,0.0
How much of a beat down would this have been when everyone wa begging for it a couple year ago?,3,5,2,1,1,0,20,0.0,1.0,0.0,0.0
Rising MMA Star Victoria Lee Dead At 18,0,1,5,0,0,0,8,0.381,0.619,0.0,-0.6486
Can Arman Tsarukyan beat Islam Makhachev in a rematch?,0,1,5,0,0,0,9,0.0,1.0,0.0,0.0
Confirmed: Khabib Nurmagomedov ha ‘left the MMA industry’,0,2,5,0,1,0,8,0.0,1.0,0.0,0.0
Rafael Fiziev say he's really excited to fight Justin Gaethje,0,3,4,1,1,0,10,0.211,0.59,0.199,-0.044
What are the most high-percentage takedown in judo for MMA?,1,1,3,1,0,1,10,0.0,1.0,0.0,0.0
Rafael Fiziev confirms that his fight against Justin Gaethje is in the work,0,2,6,0,0,0,13,0.178,0.822,0.0,-0.3818
Every Mythical Fighter Of The UFC | Explained,0,1,4,0,0,0,8,0.0,0.789,0.211,0.1531
"Does anyone else think these water bottle look incredibly cheap and tacky? Not just that it is ‘Monster’, but the design itself.",3,3,6,4,1,0,22,0.0,1.0,0.0,0.0
Running partner,0,1,1,0,0,1,2,0.0,1.0,0.0,0.0
"Undefeated Tajikistani sensation Nurullo Aliev (8-0) is set for his UFC debut. He'll fight Rafael Alves (20-11) at #UFCVegas70 on Feb. 25, per multiple sources. Story headed to @MMAjunkie.",2,6,14,0,0,0,29,0.085,0.915,0.0,-0.3818
Derrick Lewis (26-10) is going HARD for his upcoming fight v Sergey Spivak (15-3) who take the short end of the shaft in this one?,2,3,12,0,1,0,25,0.171,0.829,0.0,-0.5766
When she asks Colby what he want in bed,0,2,2,0,1,0,9,0.0,1.0,0.0,0.0
@AnikFlorianPod: THE VOTES ARE IN... @RAYLONGOMMA IS 2022 COACH OF THE YEAR! Ray Longo Accepts Coach Of The Year with Jon Anik &amp; Kenny Florian | 2022 AFPA's | 2022 UFC Recap https://t.co/So70TOXioH https://t.co/Sb6cg2bovR,0,0,26,0,1,0,34,0.0,0.923,0.077,0.3802
Shout-out to one of the pound for pound best chin in the sport…. Dustin Poirier . Don’t know how he take some of those shot,1,2,9,0,1,0,25,0.0,0.846,0.154,0.6369
Finally...,0,0,1,0,1,0,1,0.0,1.0,0.0,0.0
How do I sign up to be the first to get ticket to the upcoming Jon Jones fight this year?,2,5,4,1,1,0,20,0.126,0.874,0.0,-0.3818
This video always brings tear to my eye 😐,0,2,3,1,1,0,9,0.213,0.787,0.0,-0.2263
You Vs the Guy she tell you not to worry about,0,3,1,1,1,0,11,0.0,0.806,0.194,0.3412
Rafael Fiziev vs. Justin Gaethje in Development for March according to Fiziev,0,1,7,0,0,0,12,0.0,1.0,0.0,0.0
"Li Jingliang Offers To Fight Tony Ferguson, RDA, Bryan Barberena &amp; More",1,0,10,0,0,0,12,0.191,0.809,0.0,-0.3818
Darren Till just uploaded this and now his whole account ha gone??? Anyone know what's happened?,1,5,5,2,1,0,16,0.0,1.0,0.0,0.0
Your weekly /r/MMA recap for the week of January 01 - January 07,1,0,5,0,0,1,13,0.0,1.0,0.0,0.0
"Seems like this is in the work for March, per @freakmma, finally..",0,1,5,0,1,0,12,0.0,0.815,0.185,0.3612
Used midjourney to imagine Jesus in the UFC,0,2,3,0,1,0,8,0.0,1.0,0.0,0.0
If Conor wouldn't have fought at UFC 229 would the Khabib/Ferguson Fight had happened instead or no? What do you think?,0,7,4,1,1,0,21,0.205,0.717,0.078,-0.4936
Who y’all got ?,0,1,0,0,1,0,4,0.0,1.0,0.0,0.0
RIP,0,0,1,0,0,0,1,0.0,1.0,0.0,0.0
UFC Fight Night: Imavov vs. Gastelum Previews &amp; Predictions,0,0,8,0,0,0,9,0.245,0.755,0.0,-0.3818
Does Khabibs retirement change your thought on the outcome of Islam Vs Volks?,0,0,9,0,0,1,13,0.0,1.0,0.0,0.0
Sean O'Malley claim Dana White's wife 'DESERVED a slapping back' after domestic violence incident,2,1,9,0,0,0,14,0.255,0.745,0.0,-0.6249
When great fighter lost their 0,1,1,1,0,1,0,6,0.365,0.208,0.427,0.3818
One of the coolest man to ever join the UFC,0,1,3,1,1,0,10,0.0,0.804,0.196,0.296
Gaethje v Fiziev could be booked for March-April,0,2,4,0,1,0,8,0.0,1.0,0.0,0.0
Life isn’t fair,1,1,1,0,1,0,3,0.0,0.465,0.535,0.3182
Dillon Dani’s claim that khamzat chimaev would be the easiest submission of his life if they did fight who win and how??,1,4,8,0,1,0,22,0.091,0.668,0.241,0.644
Does anyone agree that the main reason Dana did Paddys podcast is co they had pre agreed to slag off Ariel?,2,6,8,1,1,0,21,0.0,0.805,0.195,0.5574
Looking for other ChatGPT answer to the GOAT discussion,1,1,4,0,0,0,9,0.0,1.0,0.0,0.0
Pound for pound. Headshot. Dead.,1,0,3,0,1,0,5,0.518,0.482,0.0,-0.6486
Kevin Lee discus being out of the spotlight &amp; plan to fight in 2023 | ESPN MMA,0,3,8,0,0,0,17,0.148,0.852,0.0,-0.3818
There’s another one! Khamzat ‘Borz’ Maaev Finishes His Opponent In The First Round!,0,0,9,0,1,0,13,0.0,1.0,0.0,0.0
@AnikFlorianPod: Audio of the Latest #AnikFlorianPodcast is Available Now on All Platforms! 🎧: https://t.co/9h2lx2cqC0,2,1,7,1,1,0,14,0.0,1.0,0.0,0.0
Ngannou to Pfl?,0,1,1,0,1,0,3,0.0,1.0,0.0,0.0
Renan Barao-Rao-Rao (throwback to UFC 149 video),0,1,4,0,1,0,7,0.0,1.0,0.0,0.0
"Khamzat ""Borz"" Maaev finishing his opponent at Khan Fight 2",0,1,6,0,0,0,10,0.245,0.755,0.0,-0.3818
Content of Fast-food restaurant,0,0,3,0,1,0,4,0.0,1.0,0.0,0.0
Prime Superman v Prime Bisping with a kryptonite stuffed into his right eye cavity Who wins?,2,2,8,0,1,0,16,0.0,0.791,0.209,0.5719
Theory: Usman fight Leon again and loses because of his hand injury,0,1,6,1,1,0,12,0.411,0.421,0.168,-0.5574
BREAKING NEWS: Dana White will face Anne White in a non-title fight at UFC 284.,1,1,8,0,1,0,15,0.167,0.833,0.0,-0.3818
UFC owner Endeavor among possible buyer of WWE,1,0,5,0,0,0,8,0.0,1.0,0.0,0.0
@AnikFlorianPod: THE @JON_ANIK AND @KENNYFLORIAN PODCAST AWARDS FULL EPISODES NOW ON @DRAFTKINGS YOUTUBE HERE: https://t.co/oAo9rujJNz https://t.co/EI9HfB5f4c,0,0,15,0,1,0,16,0.0,0.801,0.199,0.5766
Victoria Lee gone too soon.,1,1,2,1,1,0,5,0.0,1.0,0.0,0.0
"Who else think that Joe is so funny promoting the manscaped trimmer? ""You gotta have the best nutsack in the Cul de sac.",3,4,7,2,1,0,23,0.0,0.651,0.349,0.8938
2 minute of Victoria Lee's grappling highlight,0,1,4,0,0,0,7,0.0,1.0,0.0,0.0
And people say he will do what he did to Bradey to Khamzat.,0,5,1,0,1,0,13,0.0,1.0,0.0,0.0
A lot of people need a reality check,0,1,4,0,1,0,8,0.0,1.0,0.0,0.0
Kevin Holland think fighting 3 time a year and making $120k before camp cost is good.,2,4,6,0,0,0,16,0.144,0.69,0.167,0.1027
Am I a coward?,0,0,2,0,0,0,4,0.75,0.25,0.0,-0.4588
Hottest female mma fighters?,0,0,4,0,1,0,4,0.286,0.714,0.0,-0.0516
How do you think dating a female mma fighter would go?,1,4,2,0,1,0,11,0.0,0.849,0.151,0.1531
Rate My Middle School Art Project 1–10,0,0,6,0,1,0,7,0.0,1.0,0.0,0.0
PFL 2023 Schedule?,0,0,2,0,0,1,3,0.0,1.0,0.0,0.0
Hindi na maka hinga si kuya krisss😨😨hoy tumawag ka ng 911,1,2,5,1,1,0,11,0.0,1.0,0.0,0.0
@AnikFlorianPod: 8th Annual AFPA Awards with Ray Longo (Anik &amp; Florian Podcast Awards for 2022) https://t.co/oAo9rujJNz https://t.co/1CkLGMfd7N,1,0,11,1,1,0,17,0.0,0.714,0.286,0.7184
Gervonta Davis beat Hector Garcia brutal tko shot,1,0,7,0,0,0,8,0.369,0.631,0.0,-0.6249
Who is your favorite knockout artist?,1,1,2,0,1,0,6,0.0,0.625,0.375,0.4588
Why doe Sean O’ Malley post video of him smoking bud when it’s not supposed to be allowed in UFC competition?,0,6,8,1,1,1,21,0.0,1.0,0.0,0.0
Who would come out on top?,0,1,1,1,1,0,6,0.0,0.735,0.265,0.2023
Anyone know the science of a powerful strike?,1,1,3,0,1,0,8,0.161,0.538,0.301,0.3182
Khabib leaving mma? Does that mean he won’t corner Islam?,0,4,4,0,1,0,10,0.0,1.0,0.0,0.0
"[Official] General Discussion Thread - January 08, 2023",1,0,4,0,0,0,8,0.0,1.0,0.0,0.0
Nick Diaz v Nate Diaz who would win in MMA?,0,1,6,0,1,0,10,0.0,0.703,0.297,0.5859
[Spoiler] Main card fighter loses by unanimous decision -- despite out-striking opponent by a huge margin in every round.,3,0,9,0,0,0,19,0.108,0.708,0.184,0.1531
Why do people hate khabib so much after he left mma ? it just sad a legend isn't being appreciated.(photo by freak.mma),0,6,5,4,1,0,22,0.274,0.726,0.0,-0.7783
Russians fighting at UFC,0,1,2,0,1,1,4,0.455,0.545,0.0,-0.3612
Khamzat is looking huge man. (via chimaev/IG),1,2,4,0,1,0,7,0.0,0.723,0.277,0.3182
"Valentina Shevchenko Isn't Concerned With Setting Records. “My understanding is that everyone would love to fight for a title, so what’s happening with you girls? Why so quiet?”",2,6,9,2,0,0,28,0.081,0.777,0.142,0.4515
"“My understanding is that everyone would love to fight for a title, so what’s happening with you girls? Why so quiet?”",2,5,4,2,0,0,21,0.103,0.715,0.181,0.4515
To fan of Jon Jones:,0,0,3,0,1,0,5,0.0,1.0,0.0,0.0
Hot take: Gilbert Burns is the most overrated fighter in WW division,1,1,7,1,1,0,12,0.0,0.854,0.146,0.2212
An argument against open scoring,1,0,2,0,1,0,5,0.385,0.615,0.0,-0.3612
@AnikFlorianPod: 8th Annual AFPA Awards with Ray Longo (Anik &amp; Florian Podcast Awards for 2022) https://t.co/oAo9rujJNz https://t.co/sxkrv662qH,1,0,11,1,1,0,17,0.0,0.714,0.286,0.7184
"Khabib Nurmagomedov retires a MMA coach, status for Islam Makhachev title fight up in the air",0,2,9,1,0,0,16,0.148,0.852,0.0,-0.3818
The 4 #RoadToUFC final on February 4th during #UFCVegas68.,1,0,3,0,0,0,9,0.0,1.0,0.0,0.0
Sean O’Malley: Dana White’s wife deserved to be slapped back,1,3,4,1,0,0,10,0.0,1.0,0.0,0.0
Henry Cejudo urge Aljamain Sterling to 'stay away from that damn Hennessy',0,2,6,1,0,0,12,0.197,0.803,0.0,-0.4019
gone way too soon. rip young warrior,2,1,3,1,0,0,7,0.0,1.0,0.0,0.0
"Islam Makachev is the type of guy I want my sister to marry. Quiet Good Looking Humble Strong Hard Working And doesn’t run his mouth, (like a certain salty Irishmen). What I’m saying is, Islam Makachev is who everyone should aspire to be like. He is a one of a kind.",3,10,21,0,1,0,51,0.025,0.703,0.272,0.9201
Do you guy think Dillon Danis is dealing with Mental Health issue ?,0,5,5,0,0,1,13,0.0,1.0,0.0,0.0
😂 New TMZ footage of UFC’s Dana White slapping his wife! #danawhite #tmz #mma #ufc,1,1,11,0,1,0,15,0.0,1.0,0.0,0.0
In this era of shit talk. Will we ever see another GSP?,1,1,3,1,1,0,12,0.247,0.753,0.0,-0.5574
Nobody asks Khabib/Islam or Khamzat about Ukraine. Nato is at war with Putin/Ramzan. Dana slap his wife? We all silent?,0,4,9,0,1,0,20,0.183,0.817,0.0,-0.644
"Not UFC, but still impact the MMA community. RIP to Victoria Lee. She wa only getting started 💔",0,4,7,3,1,0,18,0.0,1.0,0.0,0.0
‘You should never put your hand on a woman’ — Dustin Poirier responds to Dana White slapping his wife,0,3,9,1,0,0,19,0.0,1.0,0.0,0.0
shredded black beast 3.0 is coming to haunt Spivac,2,3,2,0,1,0,9,0.252,0.748,0.0,-0.4019
Francis Ngannou post picture with his family member wearing an eye raising shirt,0,3,7,0,0,0,13,0.0,1.0,0.0,0.0
How successful do you see Bo being in the ufc and who beat him at middleweight?,2,4,2,0,1,0,16,0.0,0.798,0.202,0.5859
volky boy volk,0,0,3,0,1,0,3,0.0,1.0,0.0,0.0
Woman meeting Alex Pereira,0,0,4,0,1,0,4,0.0,1.0,0.0,0.0
This is how you win a fight.,0,2,1,0,1,0,7,0.25,0.385,0.365,0.296
Former UFC fighter Cain Carrizosa arrested for allegedly punching a woman and giving her a seizure. Has been charged after allegedly assaulting a woman on two separate occasions.,1,6,10,2,0,0,28,0.255,0.621,0.124,-0.6369
"Remember it’s not against the rule to juice. You just have to have your test level fall into an acceptable range, and that acceptable range is way higher than the average person test levels.",4,6,9,2,1,0,34,0.0,0.874,0.126,0.5574
"MMA fan who do/have trained in any sense: Who is the best person that you’ve competed against or even trained hard with in any martial art/combat sport? And how’d you do? Im curious, even if it’s just the best dude in your local town.",6,5,12,4,1,0,44,0.027,0.762,0.211,0.8924
"In a sport like cage fighting it wa a treat to see a dude conduct himself the way he did. Wish more guy carried themselves the same way, he showed you can a PPV star without the theatrics.",4,6,10,0,1,0,38,0.062,0.743,0.196,0.6597
Victoria Lee dead RIP (sister of Angela Lee),1,0,6,0,1,0,8,0.381,0.619,0.0,-0.6486
Should I learn to box with a southpaw stance being R handed?,1,3,3,0,0,1,12,0.0,1.0,0.0,0.0
“Mike Tyson is like that chill uncle at the barbecue am I right?”,0,3,4,0,0,0,13,0.0,0.815,0.185,0.3612
You Vs the Guy she told you not to worry about,0,3,1,1,1,0,11,0.0,0.806,0.194,0.3412
دولارات 💵,0,0,2,0,1,0,2,0.0,1.0,0.0,0.0
"Hopefully we get an episode with Diego Sanchez,Tony Ferguson, Nate Diaz, Jesse Taylor , Roy Nelson , Diego Brandao all in one episode... How do you think that episode would turn out ?",0,4,15,1,1,0,33,0.0,0.915,0.085,0.4019
Who do u think is the most underrated mma fighter of all time?,2,2,4,1,1,0,13,0.117,0.883,0.0,-0.1189
Who do you think is the most underrated mma fighter of all time?,1,3,3,1,0,0,13,0.0,0.866,0.134,0.2177
"Wow , just sad. R.I.P",0,0,3,1,0,0,5,0.348,0.225,0.427,0.1779
wow. R.I.P,0,0,2,0,0,0,2,0.0,0.208,0.792,0.5859
Ciryl Gane sparring French amateur boxing champion,1,2,4,0,0,0,7,0.0,0.606,0.394,0.5994
Lioness in training camp,0,0,3,0,0,0,4,0.0,1.0,0.0,0.0
Raiders RB Ameer Abdullah Almost KNOCKS OUT Seahawks Player With A Karate Kick! 🤯 #raiders #shorts,0,0,15,0,0,0,16,0.0,1.0,0.0,0.0
No way this M'Fu*kers makin 170lb anytime soon,0,0,2,2,1,0,8,0.239,0.761,0.0,-0.296
So young and talented. Rest In Power Victoria Lee! #rip #mma #onechampionship #wear...,2,0,8,1,0,0,13,0.0,0.757,0.243,0.5935
So young and talented. Rest In Power! #rip #mma #onechampionship #wear...,2,0,6,1,0,0,11,0.0,0.722,0.278,0.5935
"Hey Guys! I’m an mma blogger, looking to start contributing and writing for some recognised site and start to get my work out there. Any recommendation on good people or page to contact? Also dropped a link to my most recent blog post below if anyone fancy a read. Thanks!",3,10,16,4,0,0,50,0.0,0.878,0.122,0.7494
Tommy Townsend aka Conor McGregor,0,1,4,0,1,0,5,0.0,1.0,0.0,0.0
"Future star Victoria Lee, sister of One Championship’s Angela Lee, ha a passed away at 18.",0,2,8,1,0,0,16,0.0,1.0,0.0,0.0
@AnikFlorianPod: THE @JON_ANIK AND @KENNYFLORIAN PODCAST AWARDS FULL EPISODES NOW ON @DRAFTKINGS YOUTUBE HERE: https://t.co/oAo9rujJNz https://t.co/Xlxl2c8exW,0,0,15,0,1,0,16,0.0,0.801,0.199,0.5766
"Butt slapping league in Bucharest, Romania.",0,1,4,0,1,0,6,0.0,1.0,0.0,0.0
ONE Championship rising star Victoria Lee dead at 18,0,2,4,0,0,0,9,0.303,0.493,0.204,-0.34
"UFC Fight Night 220 update: Alex Reyes back after more than 5 years, will welcome Trevor Peek",1,1,9,1,0,0,17,0.133,0.714,0.153,0.1027
Supplementing the month off by watching all 3 John Wick movie back to back,0,3,4,1,1,0,14,0.0,1.0,0.0,0.0
This sub get weird without fights. Why not rewatch entire past events?,4,2,2,1,1,0,12,0.122,0.716,0.162,0.1426
Flying With American Psycho,0,1,2,0,1,0,4,0.0,1.0,0.0,0.0
"Alexander Volkanovski at 34 year old is getting more accurate, AND more evasive",4,2,4,1,0,0,13,0.0,1.0,0.0,0.0
Who’s retaining and who’s gaining?,0,0,4,0,1,0,5,0.0,0.588,0.412,0.4215
If you had to be a UFC fighter's prison bitch who would it be?,0,3,4,0,1,0,14,0.392,0.608,0.0,-0.7964
"Helwani mostly classy in DW slap incident, but, this guy take himself too seriously.",0,3,6,2,1,0,14,0.126,0.675,0.199,0.0516
Doreen Danis,0,0,2,0,1,0,2,0.0,1.0,0.0,0.0
UFC greatest First and last fight,2,0,3,0,1,0,6,0.248,0.367,0.385,0.3612
UFC 280 ppv buys?,0,0,2,0,1,0,4,0.0,1.0,0.0,0.0
UFC 280 PPV buy numbers?,0,0,3,0,0,1,5,0.0,1.0,0.0,0.0
r/UFCTakes,0,0,1,0,1,0,1,0.0,1.0,0.0,0.0
Khamzat Chimaev looking thick,0,1,3,0,1,0,4,0.0,1.0,0.0,0.0
ONE Championship’s Victoria Lee dy at 18,0,1,3,0,0,0,7,0.0,1.0,0.0,0.0
Victoria Lee ha passed away,0,2,2,1,0,0,5,0.0,1.0,0.0,0.0
Angela Lee share that little sister Victoria Lee passed away at 18 year old,2,2,6,1,0,1,14,0.0,0.855,0.145,0.296
Leglocks in MMA - doe it work?,0,2,2,0,0,1,7,0.0,1.0,0.0,0.0
"Victoria Lee (3-0), sister of Christian and Angela Lee ha passed away",1,2,6,1,0,0,12,0.0,1.0,0.0,0.0
[Angela Lee on Instagram] Victoria Lee ha passed away,1,2,4,1,0,0,9,0.0,1.0,0.0,0.0
Alex 'Poatan' Pereira catch up with his indigenous tribe Pataxó,1,1,4,1,0,0,10,0.0,1.0,0.0,0.0
"""MEDIA SILENCE"" OVER DANA WHITE AND HIS WIFES NEW YEARS EVE ALTERCATION.",1,0,10,0,0,0,12,0.0,1.0,0.0,0.0
"MAINSTREAM MEDIA SILENCE DANA WHITE BEING ""RIPPED"" BY FORMER FIGHTERS FROM ALL ANGLES.",1,0,12,0,0,0,13,0.091,0.909,0.0,-0.0516
Conor couldn't stop himself from posting on Khabib's recent MMA withdrawal Insta post,1,2,7,0,0,0,13,0.0,0.786,0.214,0.2472
Fair point,0,0,2,0,1,0,2,0.0,0.303,0.697,0.3182
Edson Barboza get a mural.,0,1,3,0,0,0,5,0.0,1.0,0.0,0.0
Islam Mount Everest cutting bratha,0,1,4,0,1,0,5,0.273,0.727,0.0,-0.128
O'Malley in highschool,0,0,2,0,1,0,3,0.0,1.0,0.0,0.0
"Chael ""The undefeated"" Sonnen says: Heelhooks do not work!",1,2,5,1,1,1,9,0.0,1.0,0.0,0.0
Chimaev on those McGregor supplement,0,0,3,0,1,0,5,0.0,1.0,0.0,0.0
Will I even be able to learn how to kickbox?,1,3,0,1,0,0,10,0.0,1.0,0.0,0.0
Anyone have the video of Ilia Topouria getting in a bar fight?,0,2,6,0,0,1,12,0.206,0.794,0.0,-0.3818
Amanda Nunes really pushing it to the limit.,0,1,3,1,1,0,8,0.0,1.0,0.0,0.0
Screw Dana!,0,0,2,0,1,0,2,0.629,0.371,0.0,-0.1759
Derrick Lewis appears to be in tremendous shape ahead of his fight v Sergey Spivak on Feb. 4,1,2,8,1,0,0,18,0.14,0.86,0.0,-0.3818
I seriously can't wait to see To Be Determined (on the left) against To Be Determined (on the right). Who you guy picking?,0,8,4,1,1,0,23,0.067,0.745,0.188,0.4767
Khamzat v Usman. Who would win and why?,0,2,4,0,1,1,8,0.0,0.648,0.352,0.5859
Derrick Lewis look thinner than ever!,1,1,3,0,1,0,6,0.0,1.0,0.0,0.0
@AnikFlorianPod: EP. 378: Anik and Florian 2022 UFC Recap - 8th Annual AFPA Awards with Ray Longo 🎙 Hosts: @jon_anik &amp; @kennyflorian 🗣 Feat: @raylongomma https://t.co/oAo9rujJNz https://t.co/iPvvJqDsml,3,0,18,0,1,0,27,0.0,0.885,0.115,0.4588
What are five matchup you want the UFC to make in 2023?,0,3,2,0,0,1,12,0.0,0.894,0.106,0.0772
What happened to our boy Derrick Lewis?,0,1,3,0,0,0,7,0.0,1.0,0.0,0.0
"Afternoon everyone, what’s your opinion on George “Rush” St-Pierre? I really enjoy his background on a lot of different martial arts. And his personality, he’s a pretty funny dude",4,3,10,1,1,0,29,0.0,0.706,0.294,0.8622
NBA player Kyle Kuzma comment on the ESPN coverage of the Dana White slap incident.,0,0,11,0,1,0,15,0.0,0.897,0.103,0.1531
UFC Lightweight champ Islam Makhachev with some unique training preparation for his fight with Alex Volkanovski at #UFC284:,1,0,11,0,0,0,18,0.12,0.737,0.143,0.128
I guess Uncle Fester had enough and ha decided to troll tf out of u,1,5,3,0,1,0,15,0.0,1.0,0.0,0.0
February 4th UFC Fight Night (Lewis vs. Spivak) will have a 1am ET/10pm PT start time for the main card,1,1,11,0,0,0,20,0.126,0.874,0.0,-0.3818
February 4th UFC Fight Night (Lewis vs. Spivak) will have a 1am ET/10pm PT start time,0,1,10,0,0,0,16,0.157,0.843,0.0,-0.3818
Khabib Nurmagamedov seemingly confirms his exit from all form of MMA.,0,1,5,1,1,0,11,0.0,1.0,0.0,0.0
Best one I’ve seen,1,1,1,0,1,0,4,0.0,0.417,0.583,0.6369
"UPDATE on the Phil Baroni case; Transported to State Prison, Facing 30-50 year",0,1,8,0,0,0,13,0.216,0.784,0.0,-0.5106
UPDATE on the Phil Baroni case,0,0,4,0,0,0,6,0.0,1.0,0.0,0.0
Belal say he want Khamzat because ‘Nobody think Leon Edwards is the best right now’,2,4,6,0,1,0,15,0.0,0.769,0.231,0.6369
Dillion Danis Gets Bullied So much they are now giving out warning before you respond to his comment,0,3,6,4,1,0,18,0.266,0.633,0.101,-0.5994
Iran executes karate champion and volunteer children's coach amid crackdown on protest,1,1,7,0,0,0,12,0.12,0.633,0.247,0.4588
Derrick Lewis potentially moving to LHW?? He looking a lot slimmer..,0,2,5,1,1,0,11,0.0,1.0,0.0,0.0
5 Ways To Win Any Fight,0,1,3,0,0,0,6,0.277,0.319,0.404,0.296
Ilia Topuria allegedly involved in a bar brawl after being being shoved by a random patron,0,4,6,1,1,0,16,0.0,1.0,0.0,0.0
I swear this is Tony Ferguson a an Avatar Na'Vi,0,2,4,0,0,1,10,0.13,0.87,0.0,-0.0516
Where to learn and train MMA in Miami?,0,2,2,0,0,1,8,0.0,1.0,0.0,0.0
Recommended betting platform for UFC?,0,1,3,0,1,1,5,0.0,0.69,0.31,0.2023
"Dan Miragliotta's reaction when Michael Chandler headbutts, blow his bloody nose on, fish hook &amp; strike the back of Dustin Poirier's head multiple time",2,3,15,0,1,0,24,0.197,0.803,0.0,-0.6597
Breaking: Leaked Chats Reveal Khabib Is Retiring From All Forms of MMA Including Coaching,0,2,10,0,1,0,14,0.15,0.85,0.0,-0.3182
Jeff Wagenheim: We've been told to not write anything incendiary on social medium about the Dana White slapping situation,2,4,8,1,0,0,19,0.0,1.0,0.0,0.0
It's been a decade for Jones talking about Heavyweight.,0,2,4,0,0,0,9,0.0,1.0,0.0,0.0
@AnikFlorianPod: THE VOTES ARE IN... @RAYLONGOMMA IS 2022 COACH OF THE YEAR! Ray Longo Accepts Coach Of The Year with Jon Anik &amp; Kenny Florian | 2022 AFPA's | 2022 UFC Recap https://t.co/So70TOXioH https://t.co/sRxZeXBD6A,0,0,26,0,1,0,34,0.0,0.923,0.077,0.3802
Do you think this give Alex a better shot at beating Islam?,1,4,3,0,1,0,12,0.201,0.604,0.195,-0.0258
Islam v Volkanovski thoughts?,0,0,4,0,1,0,4,0.0,1.0,0.0,0.0
Jiří Procházka‘s flying knee,0,1,3,0,0,0,4,0.0,1.0,0.0,0.0
Best Fight Nights ever??,1,0,3,0,1,1,4,0.284,0.218,0.498,0.4515
Francisco Prado's wild last fight against Jose Barrios. He make his UFC debut against brawler Jamie Mullarkey at UFC 284,2,2,10,0,0,0,20,0.12,0.88,0.0,-0.3818
Did Belal just confirm the Leon rematch 👀,0,1,5,1,1,0,8,0.0,1.0,0.0,0.0
Can I get a couple caption for this since it’s not much news rn,1,1,5,1,1,0,14,0.0,1.0,0.0,0.0
How far do you see this knockout machine going in the HW division?,0,3,4,1,1,0,13,0.0,1.0,0.0,0.0
"Ladies and gentleman the best 170 pounder in the world, Belal remember the name Muhammad.",1,1,7,0,1,0,15,0.0,0.769,0.231,0.6369
Any insight on Khabib being done?,0,1,3,0,0,0,6,0.0,1.0,0.0,0.0
6 Effective Push Ups To Build Muscles | Without Gym | Home Workout,1,1,9,0,1,0,13,0.0,0.744,0.256,0.4767
Jon ‘literally bones’ Jones,0,1,2,1,1,0,4,0.0,1.0,0.0,0.0
Eagle retires again,0,1,1,1,1,0,3,0.0,1.0,0.0,0.0
Rate this Mcgregor impression 1-10 be brutally honest pls.,2,1,4,1,1,0,9,0.258,0.323,0.419,0.128
Arjan Bhullar and Anatoly Malykhin are set to collide at ONE Fight Night 8(March 24th) to unify the ONE Heavyweight World Title!,0,4,10,0,0,0,22,0.173,0.827,0.0,-0.4926
Surely not!?,1,0,0,1,1,0,2,0.0,0.239,0.761,0.4926
"You have to take a road trip across the country with another fighter, who you choosing?",0,3,4,0,1,0,16,0.0,0.897,0.103,0.1531
Alex Pereira,0,0,2,0,1,0,2,0.0,1.0,0.0,0.0
"Gilbert Burns reveals plan for fight with Belal Muhammad and Khamzat Chimaev after UFC 283: ""I'll be ready""",0,2,11,0,0,0,18,0.127,0.755,0.118,-0.0516
Ciryl Gane sparring with French boxing champion,1,2,3,0,0,0,7,0.0,0.606,0.394,0.5994
"“What’s the weather like in Australia, who cares!”",0,1,2,0,1,0,8,0.0,0.715,0.285,0.4199
I don’t do mma*,0,2,1,0,0,1,4,0.0,1.0,0.0,0.0
Who are your top 5 most well rounded fighter of all time. Basically a Jack of all Trades and HOF potential.,3,1,7,1,1,0,21,0.068,0.739,0.194,0.4077
Jake Paul's PFL is doing nothing to the UFC.,0,2,5,0,1,0,9,0.0,1.0,0.0,0.0
What do you think about Powerslap?,0,2,1,0,1,0,6,0.0,1.0,0.0,0.0
Name your GOAT in each weight division,0,1,3,0,1,0,7,0.0,1.0,0.0,0.0
Kamaru Usman's effective upper body takedown,2,0,4,0,1,0,6,0.0,0.617,0.383,0.4767
My dumbest idea yet: Thompson Vs Adesanya for the MW interim title,2,0,7,0,1,0,12,0.231,0.769,0.0,-0.5106
Khabib Nurmagomedov to leave the sport of MMA completely,0,1,4,1,0,0,9,0.13,0.87,0.0,-0.0516
why aren't we talking about Stipe?,0,1,2,0,0,0,6,0.0,1.0,0.0,0.0
GPTMMA is born,0,2,1,0,1,0,3,0.0,1.0,0.0,0.0
internet stay undefeated 🤣,0,1,3,0,1,0,4,0.0,1.0,0.0,0.0
ChatGPT Predicts Ngannou v Jones,0,0,5,0,1,0,5,0.0,1.0,0.0,0.0
ChatGPT predicts Ngannou v Jones,0,1,4,0,0,0,5,0.0,1.0,0.0,0.0
Advice on how to get tickets?,1,1,1,0,1,0,6,0.0,1.0,0.0,0.0
out of everyone in this photo the one person who doe not deserve happiness is TJ dillashaw. this post is basically to prove me wrong for this little snake in the grass.,2,5,9,2,1,0,32,0.167,0.833,0.0,-0.7205
Hot Take$ Leon loses his first title defense,1,1,5,0,1,0,8,0.235,0.612,0.153,-0.2023
"O'Malley speaks out: ""I feel bad for Dana""",2,1,4,0,1,0,8,0.333,0.667,0.0,-0.5423
Ciryl Gane sparring the french amateur boxing national champion,2,2,4,0,1,0,9,0.0,0.672,0.328,0.5994
A fighter finally speaks out on Dana White incident... in support of him,0,1,5,2,0,0,13,0.0,0.699,0.301,0.5106
Dana creaming himself rn.,0,1,2,0,1,0,4,0.0,1.0,0.0,0.0
Funniest thing he’s a jon jones fan accusing Islam of peds,1,1,7,0,1,0,11,0.116,0.479,0.404,0.6369
"Volkanovski doe not have a weight disadvantage against Islam. He wa an absolute tank during rugby, he’ll fill up just fine and be great at 155",5,5,5,3,1,0,26,0.0,0.728,0.272,0.8037
Face of the people 😭,0,1,2,0,1,0,5,0.0,1.0,0.0,0.0
