title,adj_num,verb_num,noun_num,adv_num,subreddit,selftext,word_count,neg_sent_score,neutral_sent_score,pos_sent_score,cmpd_sent_score
"""Funny MMA"" FB site (funny MMA picture and memes) had child porn on their site for a minute. PEDOPHILES.",1,3,10,0,0,1,19,0.0,0.854,0.146,0.4404
"In your opinion, who really won this fight?",0,1,2,1,1,0,8,0.25,0.45,0.3,0.1688
BREAKING: Paddy Pimblett v Claudio Puelles in the work for UFC 286 on March 18th,0,0,9,0,1,0,15,0.0,1.0,0.0,0.0
Do active MMA fighter get brain scan to check for sign of CTE/brain damage?,1,2,8,0,0,0,14,0.243,0.608,0.149,-0.1779
Why wouldn't Connor v Islam make for a good match?,2,0,5,0,1,0,10,0.0,0.734,0.266,0.4404
Conor McGregor mocked an Irish comedian who opened up about his mental health struggle on twitter.,2,2,6,1,0,0,16,0.235,0.637,0.127,-0.296
Choose your own adventure - Bobby Knuckles Edition,1,1,4,0,1,0,8,0.0,0.723,0.277,0.3182
"The fact that TJ wa injured, it wa known and it wa hid from the betting world should also be investigated",1,8,3,1,0,0,21,0.177,0.823,0.0,-0.4767
"I've compiled some stats on MMA judging, full report in the comments!",1,1,5,0,0,0,12,0.0,1.0,0.0,0.0
"How many fighter in the UFC or otherwise are you able to recognize by name and face and know well enough to talk about in length (background, height/weight class, commonly used techniques, background, patterns, previous records, etc)?",4,7,10,4,1,0,37,0.031,0.914,0.055,0.2263
H510 front panel cord lost connection,1,1,4,0,1,0,6,0.315,0.685,0.0,-0.3182
There is hope…,0,1,1,0,1,0,3,0.0,1.0,0.0,0.0
"He's done, 1-3 in the last 5 years, always take an absurd amount of time off after every loss, and cant get himself together. he should retire",3,3,6,1,1,0,27,0.084,0.916,0.0,-0.3182
Paulo Costa say he won’t fight Whittaker due to pay issue,2,3,4,0,0,0,11,0.308,0.692,0.0,-0.4588
Who will be more successful in their division?,1,1,1,1,1,0,8,0.0,0.631,0.369,0.624
Who will be more successful in respective divisions?,2,1,1,1,1,0,8,0.0,0.456,0.544,0.7996
Could Chimaev beat Jon Jones?,0,1,4,0,1,0,5,0.0,1.0,0.0,0.0
Possible match up??,1,0,2,0,1,0,3,0.0,1.0,0.0,0.0
How prime bj penn v prime Khabib would go,2,1,4,0,1,0,9,0.0,1.0,0.0,0.0
Is this the greatest KO of all time?,1,1,2,0,1,0,8,0.0,0.625,0.375,0.6369
"Chandler Jones, Jon's brother in the NFL said he could whoop Jon's as because he's heavier and ha longer arms. dude is delusional",3,4,10,0,1,0,23,0.137,0.863,0.0,-0.5423
Whittaker v Costa is OFF of UFC 284,0,1,5,0,1,1,8,0.0,1.0,0.0,0.0
Will Francis retain? And do we count Russia a Asia or Europe?,0,3,4,0,1,0,12,0.0,1.0,0.0,0.0
Whittaker v Costa is off for UFC 284.,0,1,4,0,1,0,8,0.0,1.0,0.0,0.0
Ronda Rousey v Miesha Tate 2 | UFC Classic In-Depth,0,0,9,0,0,0,10,0.0,1.0,0.0,0.0
What were your Top 3 Fights of 2022?,1,1,1,0,1,0,8,0.284,0.526,0.189,-0.2263
Yoel Romero appreciation post,0,0,4,0,1,1,4,0.0,0.476,0.524,0.5106
Favourite up-and-comers on the roster?,0,0,3,0,1,0,5,0.0,1.0,0.0,0.0
One to Watch: Shore MMA Prodigy Lexi Walton,0,0,6,0,0,0,8,0.0,1.0,0.0,0.0
Lmao.,0,0,1,0,1,0,1,0.0,0.0,1.0,0.5994
Music is life!!,1,1,1,0,1,0,3,0.0,1.0,0.0,0.0
"Jiri Prochazka detail how he injured shoulder, why T.J. Dillashaw influenced decision to not fight",1,3,6,1,0,0,15,0.151,0.727,0.122,-0.1321
Paulo Costa and Robert Whittaker will NOT fight at UFC 284,0,1,5,1,0,0,11,0.0,0.821,0.179,0.2924
2023 predictions?,0,0,1,0,1,1,2,0.0,1.0,0.0,0.0
Ali Expansion Act will be reintroduced from the senate side in 2023.,1,2,4,0,0,0,12,0.0,1.0,0.0,0.0
"Brett Okamoto: ''Paulo Costa and Robert Whittaker will NOT fight at UFC 284 in February, per sources.''",0,1,8,1,0,0,17,0.0,0.88,0.12,0.2924
Paulo Costa and Robert Whittaker will NOT fight at UFC 284 in February,0,1,6,1,0,0,13,0.0,0.846,0.154,0.2924
Costa-Whittaker reportedly OFF UFC 284 in February,0,0,4,1,0,0,7,0.0,1.0,0.0,0.0
"If Paddy ha to ""fight up"" next, then whom do you feel should be his opponent?",1,5,3,1,0,0,16,0.148,0.852,0.0,-0.3818
Robert Whittaker-Paulo Costa bout off for UFC 284 card,0,0,5,1,0,0,9,0.0,1.0,0.0,0.0
Paulo Costa and Robert Whittaker fight OFF UFC 284,0,1,6,0,0,0,9,0.245,0.755,0.0,-0.3818
Looks like Costa wasn't trolling when he said he wasn't fighting Whitaker in Perth. Fight is officially pulled.,1,6,5,1,1,0,18,0.117,0.675,0.208,0.2523
Ovince Saint Preux and Philipe Lins are set to fight at the Feb. 18 UFC Fight Night event,0,3,10,0,0,0,18,0.245,0.755,0.0,-0.6369
"Why is anyone outside of T15 ""unranked""?",0,1,3,0,1,1,7,0.0,1.0,0.0,0.0
Whittaker v Costa is off for 284 per Brett Okamoto,0,1,5,0,0,0,10,0.0,1.0,0.0,0.0
Costa Vs Whittaker off UFC 284 Card,0,0,5,0,0,0,7,0.0,1.0,0.0,0.0
"Brett Okamoto on Twitter: ""Whiattaker-Costa off UFC 284""",0,0,5,0,0,0,8,0.0,1.0,0.0,0.0
So.... Costa v Romero 2 on bellator?,0,0,5,0,1,0,7,0.0,1.0,0.0,0.0
"The next guy who fight Connor better target that leg, because based on past fighter I don't think it will be the same. the ufc will prob. tell them not to, and threaten their career if they do...but there is no way I'm getting in the cage with that roided up freak and not going for that leg",2,14,13,4,1,0,58,0.138,0.784,0.078,-0.4434
Paulo Costa and Robert Whittaker will NOT fight at UFC 284 - Costa is out.,1,2,6,1,0,0,15,0.0,0.856,0.144,0.2924
Whittaker v Costa is off due to failed contract negotiation via Okamoto,1,2,6,1,0,0,12,0.231,0.769,0.0,-0.5106
"Whittaker-Costa off UFC 284 card, source say",0,1,4,0,0,0,7,0.0,1.0,0.0,0.0
[News] Robert Whittaker-Paulo Costa bout off UFC 284 card,0,0,6,1,0,0,9,0.0,1.0,0.0,0.0
I need to see Dober v Gaethje before I die.,0,3,2,0,1,0,10,0.358,0.642,0.0,-0.5994
Whitaker v Costa removed from UFC 284,0,1,4,0,0,0,7,0.0,1.0,0.0,0.0
"Paulo Costa ( Borrachinha ) on Twitter - Great fight is going down due to lack of negotiation skills, they should stop being petty 👍🥤 Costa’s fight at UFC 284 against Whittaker is off",1,5,14,2,0,0,34,0.285,0.614,0.101,-0.6705
Brett Okamoto say the Costa v Whittaker fight will no longer take place due to disagreement in contract discussion between Costa &amp; the UFC. Costa reponds.,1,3,14,2,0,0,26,0.257,0.743,0.0,-0.765
Fuck me . Costa will be ruining my parlay ffs,0,2,3,0,0,1,10,0.608,0.392,0.0,-0.8519
"🎉Guide To Claim 1,000 Free SEA Token Airdrop 🌊 (Current value $580)",0,1,9,0,0,1,12,0.0,0.612,0.388,0.6908
[Brett Okamoto] Costa vs. Whittaker is OFF UFC 284 in February,1,1,6,0,0,0,11,0.0,1.0,0.0,0.0
This influencer boxing match had me convinced Strickland is this guy coach,2,3,4,0,1,0,12,0.0,0.803,0.197,0.4019
Paulo Costa out of Robert Whittaker UFC 284 Fight,0,0,6,0,0,0,9,0.245,0.755,0.0,-0.3818
Is this guy trolling?,0,1,2,0,1,0,4,0.0,1.0,0.0,0.0
Paulo Costa v Robert Whittaker is OFF UFC 284,0,1,7,0,1,0,9,0.0,1.0,0.0,0.0
"lol Cody went there to be a punching bag. They're gonna Crack his chin even worst, post it up on their social medium to make themselves look good. Same way they use Khamzat. Bad move.",2,6,15,2,1,0,35,0.176,0.693,0.132,-0.4404
Robert Whittaker v Paulo Costa is off of UFC 284 in Perth,0,1,6,0,0,0,12,0.0,1.0,0.0,0.0
[Brett Okamoto]: Paulo Costa v Robert Whittaker will not occur at UFC284 in Perth,1,1,8,1,0,0,14,0.0,1.0,0.0,0.0
Low Quality Main Event Tier-List I Made For The Year of 2022. Any point of conflict?,1,1,8,0,1,0,16,0.253,0.747,0.0,-0.5267
Robert Whittaker v Paulo Costa set to take place at UFC 284 in Perth is off,0,3,7,0,0,0,16,0.0,1.0,0.0,0.0
Costa vs. Whittaker is OFF per ESPN,0,1,5,0,0,0,7,0.0,1.0,0.0,0.0
[Okamoto] Whittaker v Costa planned for UFC 284 will not happen,1,2,4,1,0,0,11,0.0,1.0,0.0,0.0
"Paulo Costa and Robert Whittaker will NOT fight at UFC 284 in February, per sources.",0,1,7,1,0,0,15,0.0,0.865,0.135,0.2924
Costa v Whittaker is off UFC 284 a per Brett Okamoto,1,1,5,0,0,0,11,0.0,1.0,0.0,0.0
Brett Okamoto reporting Costa v Whittaker is OFF,0,2,5,0,0,0,8,0.0,1.0,0.0,0.0
[Okamoto] Paulo Costa and Robert Whittaker will NOT fight at UFC 284 in February.,1,1,6,1,0,0,14,0.0,0.856,0.144,0.2924
Anyone else getting the impression that Bruce Buffer is getting a little too full of himself? More in my comment.,2,3,6,3,1,0,20,0.0,0.905,0.095,0.2263
(Okamoto) Costa vs. Whittaker OFF UFC 284,0,0,5,0,0,0,7,0.0,1.0,0.0,0.0
Paulo Costa and Robert Whittaker will NOT fight at UFC 284.,0,1,5,1,0,0,11,0.0,0.821,0.179,0.2924
This is interesting.,1,1,0,0,1,0,3,0.0,0.426,0.574,0.4019
My Favorite Jared Cannonier Moment,0,0,4,0,1,0,5,0.0,0.571,0.429,0.4588
Report: Paulo Costa and Robert Whittaker fight off UFC 284 card in February,0,1,8,1,0,0,13,0.178,0.822,0.0,-0.3818
That feel when you beat the incredibly dangerous Rousimar Palhares without a scratch,1,1,4,1,0,0,13,0.236,0.764,0.0,-0.5256
I couldn’t unsee this the whole movie,1,1,1,0,1,0,7,0.0,1.0,0.0,0.0
Taila Santos’ next fight will not be a rematch with Valentina Shevchenko. The UFC are working on something else for Santos. [per @mma_kings] Previously posted by u/ReactQ 28 at r/WMMA,2,4,13,2,0,0,30,0.085,0.915,0.0,-0.3818
How do MMA youtube channel consistently mess up fighter name when the name are said by commentator all the time during their fights?,0,5,7,3,1,0,23,0.242,0.758,0.0,-0.6597
"Like it or not, Aljo ha a very impressive resume and if he beat Cejudo he is the BW GOAT.",2,3,5,1,1,0,20,0.0,0.736,0.264,0.7264
Please understand one thing about the scoring criteria.,0,1,4,0,1,0,8,0.0,0.753,0.247,0.3182
Ring girl walking by be like..,1,3,1,0,1,0,6,0.0,1.0,0.0,0.0
Djdjdj,0,0,1,0,1,1,1,0.0,1.0,0.0,0.0
Some of the worst downfall in UFC so far,1,0,2,2,1,0,9,0.339,0.661,0.0,-0.6249
Toughest Downfalls in the UFC,1,0,2,0,1,0,5,0.245,0.755,0.0,-0.0772
"After his performance this past Saturday, Dober need to be ranked.",2,2,3,0,1,0,11,0.0,1.0,0.0,0.0
Book this fight.,0,1,1,0,1,0,3,0.565,0.435,0.0,-0.3818
Jessica Rose Clark &amp; Deron Winn On Arman Tsarukyan,0,0,8,0,1,0,9,0.0,1.0,0.0,0.0
Pls understand 1 thing about scoring. A takedown is simply a change of position. A TD by itself doesn’t win you a round. What matter is what happens AFTER the TD. Are you doing GnP and threatening subs? Or is your opponent getting up every time and/or hitting you and threatening sub from his back?,1,13,17,3,1,0,55,0.123,0.771,0.106,-0.4515
Why Chimaev v. Shavkat Is The Fight To Make,0,2,4,0,0,0,9,0.245,0.755,0.0,-0.3818
Jon Jones: The Most Disturbing UFC Champion | MMA Documentary,0,0,9,0,0,0,10,0.243,0.474,0.282,0.1458
wtf is going on here?,0,2,2,0,1,0,5,0.487,0.513,0.0,-0.5859
"If Paddy ha to ""fight down"" next fight, then whom do you feel should be his opponent?",1,5,3,2,0,0,17,0.257,0.743,0.0,-0.6369
Rolls Royce announced a Giveaway of their NEW NFT Collection for 666 Lucky Fans!,0,1,8,0,1,1,14,0.0,0.795,0.205,0.4753
"Paulo Costa say he is out of UFC 284 fight with Robert Whittaker, claim UFC didn't pay him",1,3,8,0,0,0,18,0.131,0.804,0.065,-0.3191
"I’ve noticed that ever since this fight, the commentator have been mentioning the “damage&gt;control” criterion a lot more in these last few events.",2,6,5,2,0,0,23,0.125,0.875,0.0,-0.4588
Paulo Costa suggesting he will not fight Robert Whittaker,0,2,4,1,0,0,9,0.0,0.786,0.214,0.2924
Paulo Costa say he’s not fighting Robert Whittaker at UFC 284 per financial disparity,1,2,7,1,0,0,14,0.0,0.86,0.14,0.2755
Pay the man his worth. Tomato head,0,1,4,0,1,0,7,0.169,0.602,0.229,0.128
"Maybe Paulo Costa is joking, but we may not get Costa v Whittaker.",1,2,5,2,1,0,13,0.0,0.892,0.108,0.1154
Khabib speaking on Zabit's retirement and possible return,1,1,4,0,1,0,8,0.0,1.0,0.0,0.0
Haqparast v Mullarkey pulled from UFC 284,0,1,4,0,0,0,7,0.0,1.0,0.0,0.0
"Can we chill on the low effort, intentionally bad take, trolling and downvote farming posts?",2,1,6,1,1,0,15,0.301,0.699,0.0,-0.6808
"Arman Tsarukyan say Michael Chandler, Dustin Poirier and Justin Gaethje need to retire",0,3,8,0,0,0,13,0.0,1.0,0.0,0.0
Should I start out with MMA or just BJJ,0,2,1,2,0,1,9,0.0,1.0,0.0,0.0
"This is a graphic from last year, record are not updated, but who do you think will be the next to lose their 0?",4,6,2,1,1,0,24,0.139,0.861,0.0,-0.5499
"Nahh, that’s jokes💀",0,0,3,0,1,0,3,0.0,1.0,0.0,0.0
Imagine if Yoel started earlier,0,1,2,1,1,0,5,0.0,1.0,0.0,0.0
"Is Paddy representative of ""Scousers "" or English young men in general?",2,2,5,0,1,0,12,0.0,1.0,0.0,0.0
Is it an old guy thing that i’m falling out of love with the Kids beating shit out of each other ?,2,4,5,0,1,0,22,0.279,0.578,0.143,-0.4588
"Chael, GSP &amp; Nate Diaz impression",0,0,6,0,1,0,6,0.0,0.725,0.275,0.2263
Texans aren't safe anywhere...,1,1,2,0,0,0,4,0.445,0.555,0.0,-0.3412
What is your opinion on the Ngannou situation?,0,1,3,0,1,0,8,0.0,1.0,0.0,0.0
1920's the UFC's flying knee,0,1,2,0,1,0,5,0.0,1.0,0.0,0.0
What would have to happen to you predominantly watching Bellator over UFC?,0,3,2,1,1,0,12,0.0,1.0,0.0,0.0
Goat talk,0,0,2,0,1,0,2,0.0,1.0,0.0,0.0
Why is MMA and Boxing much slower paced than kickboxing/Muay Thai?,1,2,4,1,0,1,11,0.0,1.0,0.0,0.0
Does Drew Dober get a title shot after his win over Bobby Green?,0,1,8,0,1,0,13,0.0,0.743,0.257,0.5859
Chaddy Chinblett,0,0,2,0,1,0,2,0.0,1.0,0.0,0.0
What do you guy think of this potential card? (Swipe),1,3,2,0,1,0,10,0.0,1.0,0.0,0.0
What fight do you want to see the UFC make?,0,3,3,0,1,0,10,0.218,0.672,0.109,-0.3182
Found The Guy To Fight Hasbulla,0,0,3,0,1,0,6,0.342,0.658,0.0,-0.3818
"If you have to create the perfect lightweight fighter using the attribute in the list from any lightweight in history to beat Prime Khabib, what would it be?",3,5,6,0,1,0,28,0.0,0.772,0.228,0.7506
why the FuQ is everyone on Hasbulla tiny nuts?,1,1,4,0,1,0,9,0.223,0.777,0.0,-0.3182
"unpopular opinion: calling conor mcgregor ""washed"" when he fought Dustin is a lame attempt to discredit Poiriers performance. Even prime ufc 205 mcgregor would get destroyed by Dustin. Prime Poirier destroys any version of McGregor",5,7,13,1,1,0,35,0.284,0.716,0.0,-0.8979
Dana sign him!,0,0,3,0,1,0,3,0.0,1.0,0.0,0.0
I think we all know who posted this,0,3,0,0,1,0,8,0.0,1.0,0.0,0.0
"RIZIN Confessions #112 - Bellator vs. Rizin: Horiguchi v Ougikubo, Archuleta v Kim, and more",1,0,10,0,0,0,15,0.0,1.0,0.0,0.0
What do you guy think of my breakdown on this footwork?,0,2,3,0,0,0,11,0.0,1.0,0.0,0.0
Why wa Mustafaev cut from the UFC? He KOed Fiziev and all the fight that fell through weren't his fault.,0,2,7,0,1,0,20,0.2,0.707,0.094,-0.3699
What are your prediction for this fight?,0,1,2,0,1,0,7,0.333,0.667,0.0,-0.4588
Objectively speaking is he a good mma analyst?,1,1,3,1,1,0,8,0.0,0.674,0.326,0.4404
This man would murder any top 5 LW right now,1,1,2,2,1,0,10,0.348,0.519,0.133,-0.5994
Top 10 UFC fighter according to ChatGPT ( Advanced AI),1,1,5,0,1,0,10,0.109,0.545,0.345,0.3818
What’s the best main card here?,2,0,2,0,1,0,6,0.0,0.543,0.457,0.6369
UFC Gambling Pro Nick Kalikas Opens Up About James Krause,0,1,7,1,1,0,10,0.0,1.0,0.0,0.0
I think this is the fight that NEEDS to happen next. Makes the most sense. Winner get a title eliminator. Book it Dana.,1,5,8,1,1,0,23,0.101,0.74,0.159,0.3566
Respect for Suga Sean,0,0,3,0,1,0,4,0.0,0.492,0.508,0.4767
"Tiger.Trade Exchange, A Conor McGregor Endorsed CeX, Exposed to FTX",0,2,7,0,1,0,10,0.126,0.68,0.194,0.1779
Conor McGregor's Crypto Exchange Traded Through FTX,0,0,7,0,0,0,7,0.0,1.0,0.0,0.0
What you see v What she see,1,2,0,0,1,0,7,0.0,1.0,0.0,0.0
Is Bellator v Rizin airing live or pre-recorded from Japan?,2,2,4,0,0,0,10,0.0,1.0,0.0,0.0
Who is your Fav female Fighter?,0,1,3,0,1,0,6,0.0,0.465,0.535,0.5574
Active UFC fighter with Greco roman wrestling background,1,0,6,0,1,0,8,0.121,0.606,0.273,0.3612
Good morning. I hope I distorted your broke as reality. Have a nice day.,2,3,5,0,1,0,14,0.398,0.221,0.381,-0.1027
Usman/Colby 1- Nut shot/eye poke,1,0,3,0,0,1,5,0.0,1.0,0.0,0.0
This man would murder every UFC fighter on the roaster right now because he is a warrior.,0,2,5,2,1,0,17,0.232,0.69,0.079,-0.6249
He’ll definitely have a heel turn at some point though.,0,1,5,1,1,0,10,0.0,0.748,0.252,0.4019
"Her: ""My parent aren't home.""",0,1,4,0,1,0,5,0.0,1.0,0.0,0.0
Chinese burn?,1,0,1,0,1,0,2,0.0,1.0,0.0,0.0
Title fight,0,0,2,0,1,0,2,0.722,0.278,0.0,-0.3818
"Serious question. People will condemn the MMA Guru for thing he said, then proceed to call him and all people defending him the most insulting thing imaginable. How is this better in any way, shape or form?",4,6,10,3,1,0,37,0.169,0.754,0.077,-0.4621
Brendan Schaub wa a good fighter,1,1,3,0,1,0,6,0.0,0.4,0.6,0.5423
CHEST WORKOUTS!,0,0,2,0,1,0,2,0.0,1.0,0.0,0.0
Not sure why people are saying Paddy got exposed. I feel like most fan knew he had to fix his striking to be any kind of threat at 155.,3,9,5,1,1,0,29,0.208,0.717,0.075,-0.5354
MMA v TWD,0,0,3,0,0,0,3,0.0,1.0,0.0,0.0
Who is a fair fight next for Rafael Fiziev?,1,1,3,0,1,0,9,0.239,0.55,0.211,-0.0772
Who is the fighter if the year in 2022 and why is it in Alexander Volkanowski?,0,2,4,0,1,0,16,0.0,0.904,0.096,0.1531
"Fourth member of ONE's MMA family, Adrian Lee, win amateur MMA title",2,1,8,0,0,0,12,0.0,0.748,0.252,0.5719
I'm new to UFC and wa wondering something. Why did Randy couture fight at heavyweight?,2,3,6,0,1,0,15,0.157,0.843,0.0,-0.3818
.. scandalous and untoward 👊,2,0,1,1,1,0,5,0.531,0.469,0.0,-0.5267
Dana Fredrick White Jr.,0,0,4,0,1,0,4,0.0,1.0,0.0,0.0
A short film I did about a MMA fighter and how the sport changed her life.,1,2,5,0,0,0,16,0.0,0.882,0.118,0.1531
"I respect the guy for trying MMA without leg and all power to him but which disgusting athletic commission sanctioned a man with no leg to have an actual MMA fight, it’s literally like sanctioning a fight with a 80-100lb weight difference",3,6,13,1,1,0,42,0.276,0.621,0.103,-0.872
Confidence or Skill?,0,0,2,0,0,1,3,0.0,0.377,0.623,0.5106
what happened to eagle fc?,0,2,1,0,0,1,5,0.0,1.0,0.0,0.0
Just came here to say f**k Hasbullah,1,2,1,2,1,0,7,0.0,1.0,0.0,0.0
UFC Fight Night 216 post-event facts: Drew Dober tie Dustin Poirier's knockout record,1,0,11,0,0,0,13,0.178,0.822,0.0,-0.3818
"Drew Dober call Bobby Green knockout 'something special,' explains Jalin Turner callout",0,3,9,0,0,0,12,0.0,1.0,0.0,0.0
How do you hold your hand in a neutral stance?,1,2,2,0,0,1,10,0.0,1.0,0.0,0.0
Khabib and his father were projected on skyscraper in Qatar for some reason,0,2,5,0,1,0,13,0.0,1.0,0.0,0.0
Sean Strickland staying true to his promise in Helen Yee interview and deciding to do nothing but box (point fight) for 5 rds,2,3,10,0,1,0,23,0.0,0.849,0.151,0.3716
This guy would kill everyone in the top 5. Thoughts?,1,1,3,0,1,0,10,0.324,0.552,0.124,-0.5994
Is it just me or doe MATEUSZ GAMROT look like a car mechanic??,0,3,4,1,1,0,13,0.0,0.794,0.206,0.4329
"Fiziev Vs Gaethje, and redemption fight Bobby green Vs paddy?",1,0,8,0,1,0,10,0.224,0.776,0.0,-0.3818
Who’s the most overrated UFC fighter of all time?,1,0,3,1,1,0,9,0.0,0.811,0.189,0.2177
Arnold Allen v Ilia Topuria!!,0,0,5,0,1,0,5,0.0,1.0,0.0,0.0
r/ufc member when some random prospect beat a washed up Veteran via Decision after getting knocked down 2 time,0,5,6,2,1,0,19,0.0,0.879,0.121,0.296
r/ufc member when some random prospect beat a washed up Veteran after getting knocked down 2 time,0,5,5,2,1,0,17,0.0,0.864,0.136,0.296
The classy McGregor clan,1,0,2,0,0,1,4,0.0,0.508,0.492,0.4404
Does anyone still believe Messi wouldn't beat Jose Aldo?,1,2,5,1,1,0,9,0.0,1.0,0.0,0.0
This is why Brendan Schaub got cut from Showtime,0,3,3,0,1,0,9,0.208,0.792,0.0,-0.2732
"Actual investigative journalism that take a deep look into how the Krause scandal wa precipitated by the UFC's business practice and deals. If you have ever questioned the integrity of the UFC and why thing are the way they are, this is a great watch.",4,9,12,1,0,0,45,0.086,0.78,0.134,0.5267
Reminded me of Jon Jones today at work.,0,1,4,0,1,0,8,0.0,1.0,0.0,0.0
This reminded me of Jon Jones today at work 😅😅.,0,1,5,0,0,0,10,0.0,1.0,0.0,0.0
Winner get a shot next?,0,1,3,0,1,0,5,0.0,0.441,0.559,0.5859
"[Official] General Discussion Thread - December 19, 2022",1,0,4,0,0,0,8,0.0,1.0,0.0,0.0
Matt Riddle is the only fighter to start his Pro debut in the UFC. Got released upon multiple weed violation and now he doe even more in the WWE.,2,4,10,3,1,0,29,0.106,0.844,0.05,-0.4215
Student Redditers what is the funniest thing you ever did to a teacher,1,2,4,1,1,0,13,0.0,0.753,0.247,0.5574
Arman Tsarukyan call for fight against Charles Oliveira or Beneil Dariush following UFC Vegas 66 win,0,2,10,0,0,0,16,0.132,0.683,0.185,0.2732
From UFC Fighter To African Prison Cell – Lightning Lee Murray. The biggest bank heist in British history took place in 2006. The robbery wa flawlessly planned and executed by a small-time criminal and former UFC fighter “Lightning” Lee Murray.,4,4,20,1,1,0,40,0.15,0.738,0.112,-0.5719
"“Like in the pub. One shot” thats hilarious, definitely blew a line before this tweet",0,1,6,1,1,0,15,0.0,0.69,0.31,0.6597
DOES ALEX PEREIRA LOOK LIKE A BRAZILIAN JON BERNTHAL ?,0,0,9,0,1,0,10,0.0,0.737,0.263,0.3612
"people were giving conor &amp; tony a lot of shit for being ranked, and it warranted. but why is nobody talking about how RDA (who is 1-3 at Lightweight since 2015) is ranked #7? WTF?",3,9,11,0,1,0,35,0.215,0.744,0.041,-0.8504
Zhalgas Zhumagulov NOT actually retired…,0,1,3,1,0,0,5,0.0,1.0,0.0,0.0
Suggest a nickname for Islam Makhachev,0,1,3,0,1,0,6,0.0,1.0,0.0,0.0
Tony proved his biggest hater wrong.,1,1,3,0,1,0,6,0.596,0.404,0.0,-0.7096
Who would win in a fight a grown male chimpanzee or Francis Ngannou?,1,1,5,0,1,0,13,0.169,0.584,0.247,0.296
Feed paddy to carly dana pls,0,1,4,0,1,0,6,0.0,0.794,0.206,0.0772
Is it illegal to wet willy an opponent?,1,2,1,1,1,0,8,0.34,0.66,0.0,-0.5574
Any prediction on when Bones Jones is coming back?,0,2,4,0,1,0,9,0.0,1.0,0.0,0.0
RIP Kimbo!!,0,0,2,0,0,0,2,0.0,1.0,0.0,0.0
Kimbo Slice v Houston Alexander (full fight),0,0,6,0,0,0,7,0.0,1.0,0.0,0.0
"Ricky Simon drop and submits Jack Shore, ending his 28-fight unbeaten streak(pro and amateur).",3,1,7,0,0,0,14,0.0,1.0,0.0,0.0
Arman?,0,0,1,0,1,0,1,0.0,1.0,0.0,0.0
Gervonta Davis Cold Knockout! 🥶🥊,0,0,5,0,1,0,5,0.0,1.0,0.0,0.0
Fight circus,0,0,2,0,0,0,2,0.722,0.278,0.0,-0.3818
The Secret Behind UFC PPV Points System &amp; One Championship's Pay Compared UFC's,0,0,12,0,0,0,13,0.104,0.896,0.0,-0.1027
"Former UFC champ Holly Holm returns, meet Yana Kunitskaya at upcoming Fight Night",0,1,11,0,0,0,13,0.156,0.659,0.186,0.128
Any movie that have realistic MMA/Grappling in them?,1,1,3,0,0,0,8,0.0,1.0,0.0,0.0
Chandler sending people to the shadow realm while Jon is on vacation 💀,1,2,6,0,1,0,13,0.0,1.0,0.0,0.0
Very confused a to why Muniz ha to fight down . They could have done him against so many ranked opponent in Brazil.,3,4,3,3,1,0,23,0.206,0.794,0.0,-0.6361
2023 Predictions for Colby,0,0,2,0,1,0,4,0.0,1.0,0.0,0.0
UFC Lightweights in Suits (it get weirder a you swipe left),1,3,4,0,1,0,11,0.13,0.87,0.0,-0.128
If you could choose two fighter too be in next year hall of fame who would you choose . Here is mine p.s I would’ve chose Cain but I don’t think he’s going in anytime soon sadly 😞,5,8,7,4,1,0,38,0.127,0.821,0.052,-0.431
This guy keep on rubbing shoulder with criminal 💀,1,3,2,0,1,0,9,0.346,0.654,0.0,-0.5719
What’s another crossover fight that could do similar numbers?,1,1,4,0,1,0,9,0.245,0.755,0.0,-0.3818
Not sure if you guy saw this ad but I couldn’t stop laughing 🤣,2,3,3,1,1,0,14,0.244,0.512,0.245,0.2544
HONNEH MOO,0,0,2,0,1,0,2,0.0,1.0,0.0,0.0
Paddy hypetrain get stopped a soon a he face top 10 opponent,1,3,3,2,1,0,12,0.139,0.73,0.131,-0.0258
How do you feel about the upcoming Power Slap League?,1,2,3,0,1,0,10,0.0,0.849,0.151,0.1531
"If you could bring back a past fighter in their prime, who do you think could become champ?",1,4,3,1,1,1,18,0.0,0.761,0.239,0.5719
This always reminds me of Nate. Which fighter do you think relies on their chin the most?,0,3,6,1,1,0,17,0.0,0.909,0.091,0.1531
The GOAT,0,0,1,0,0,0,2,0.0,1.0,0.0,0.0
Met this guy at a local mma event!,1,0,4,0,1,0,8,0.0,1.0,0.0,0.0
Hmm…,0,0,1,0,1,0,1,0.0,1.0,0.0,0.0
Do I have to learn striking southpaw?,1,3,1,0,0,0,7,0.0,1.0,0.0,0.0
Who deserves to be fed to Ilia Topuria next? 👹👹,0,4,2,0,1,0,10,0.0,1.0,0.0,0.0
Cody is a weird dude.,1,1,2,0,1,0,5,0.362,0.638,0.0,-0.1779
"yo, WTF is with slap fights?",1,1,3,0,1,0,6,0.611,0.254,0.135,-0.7672
"BREAKING NEWS: Paddy's next fight announced, date and location TBD",1,0,8,0,1,0,10,0.224,0.776,0.0,-0.3818
UFC Tokyo edit,0,0,3,0,1,0,3,0.0,1.0,0.0,0.0
@MMAVigillantes edit,0,1,1,0,1,0,2,0.0,1.0,0.0,0.0
Mike Jackson To Press Charges On 'Thug' Jake Shields After UFC PI 'Assault',0,0,9,0,0,0,13,0.149,0.851,0.0,-0.2732
this man would kill any top 15 lightweight,1,1,2,0,1,0,8,0.376,0.48,0.144,-0.5994
"In your opinion, which active fighter is a surefire Hall of Famer?",1,1,5,0,1,0,12,0.0,0.559,0.441,0.6486
Always been curious a to why,1,1,1,0,1,1,6,0.0,0.685,0.315,0.3182
"Zion Clark, MMA fighter born without legs, win first pro fight",2,1,7,0,1,0,11,0.368,0.526,0.105,-0.6121
No love for No Nonsense?,0,0,2,0,0,1,5,0.577,0.081,0.341,-0.2263
This would be a fun fight to make down the line.,0,2,3,1,1,0,11,0.187,0.576,0.237,0.1779
Fantasy Fight!! Francis Ngannou 🇨🇲 v Mirko Cro Cop 🇭🇷 Who Wins and How?,0,0,13,0,0,0,14,0.138,0.635,0.227,0.3987
The Strickland Enigma…..,0,0,2,0,1,0,3,0.0,1.0,0.0,0.0
Is Derrick Lewis gonna become the first fighter in ufc history to have 2 loss in a row to people named Sergei,2,5,8,0,0,1,22,0.121,0.807,0.072,-0.2732
🌹Ganhe facilmente BRL 900 por dia 🌹,1,0,5,0,0,0,7,0.0,1.0,0.0,0.0
Should i buy a purple or brown belt (never trained bjj btw)? Or is black okay too given i ll avoid any dagi?,4,7,7,1,1,0,23,0.114,0.801,0.085,-0.168
Impressive,1,0,0,0,1,0,1,0.0,0.0,1.0,0.5106
Opinion: Strickland (Rank #7) after having a competitive fight with Cannonier (Rank #3) that could’ve gone either way should move up to Rank #5,1,4,11,1,1,0,24,0.103,0.83,0.067,-0.2263
