title,adj_num,verb_num,noun_num,adv_num,subreddit,selftext,word_count,neg_sent_score,neutral_sent_score,pos_sent_score,cmpd_sent_score
Aljamain Sterling responds to Marlon ‘Chito’ Vera calling him a ‘p****’ for cutting too much weight,1,3,7,1,0,0,16,0.097,0.903,0.0,-0.128
Raphael Assunçâo will fight Kyler Phillips at Vegas 71 on March 11th,0,1,6,0,0,0,12,0.191,0.809,0.0,-0.3818
"I love Volk, his skill, his swagger…but who ha he beat that make you think he’s gonna slow down Islam?",1,6,5,1,1,0,20,0.0,0.811,0.189,0.6369
Body Cam: Assault of Colby Covington by Jorge Masvidal,0,0,7,0,1,0,9,0.322,0.678,0.0,-0.5859
Events everyone should watch,0,1,2,0,0,0,4,0.0,1.0,0.0,0.0
Jack Della Maddalena v Randy Brown added to UFC 284,0,1,7,0,0,0,10,0.0,1.0,0.0,0.0
"Top welterweight prospect Jack Della Maddalena and Randy Brown are scheduled to fight at UFC 284 in Perth, Australia. Who are you picking to win?",1,6,10,0,1,0,25,0.083,0.669,0.248,0.6369
Top welterweight prospect will be facing off at UFC 284 in February. Jack Della Maddalena will be fighting Randy Brown,1,4,9,1,1,0,20,0.106,0.723,0.17,0.128
Top welterweight prospect are facing off at UFC 284 in February in Australia. Jack Della Maddalenna will be fighting Randy Brown,1,4,10,1,1,0,21,0.102,0.735,0.163,0.128
Top welterweight prospect are facing off at UFC 284 Jack Della Maddalena is fighting Randy Brown. Who are you picking?,1,6,8,1,1,0,20,0.106,0.723,0.17,0.128
Top Welterweight prospect Jack Della Maddalena is fighting Randy Brown on February 11th at #UFC284 in Perth,1,2,10,0,1,0,17,0.122,0.683,0.195,0.128
"UFC London is 2 month away with no main event, this wa Usman on Saturday",1,2,6,1,1,0,15,0.145,0.855,0.0,-0.296
"How do you see this fight going ? can islam take and keep dariush down ? and if not and it stay standing, who win the striking ?",0,8,4,2,1,0,28,0.099,0.761,0.14,0.3049
"Islam makhachev v beneil dariush, how do you see this fight going ?",0,4,5,0,0,0,13,0.214,0.786,0.0,-0.4588
How do you see this fight going ?,0,3,1,0,0,0,8,0.333,0.667,0.0,-0.4588
"If Figueiredo win the fourth fight, will the ufc put together Moreno v Figueiredo 5 ?",2,1,6,1,1,0,16,0.142,0.656,0.202,0.2732
GSP goat,0,0,2,0,1,0,2,0.0,1.0,0.0,0.0
Your Islam v Volk prevision?,0,0,4,0,1,0,5,0.0,1.0,0.0,0.0
Jair Bolsonaro retreat to Florida to live with...... Jose Aldo?,0,2,6,0,0,0,10,0.0,1.0,0.0,0.0
Does anyone else think Saygid Izagakhmaev is better than Islam or just UFC competition is a lot harder?,1,3,9,2,0,0,18,0.0,0.847,0.153,0.4404
This fight should be a barn burner,0,1,3,0,1,0,7,0.342,0.658,0.0,-0.3818
Why doe Oliveira look so skinny ?,1,2,1,1,1,0,7,0.0,1.0,0.0,0.0
How do you see this matchup going in a 3 rounder?,0,3,2,0,1,0,11,0.0,1.0,0.0,0.0
Diabetics training MMA using Dexcom G6,0,2,4,0,0,1,6,0.0,1.0,0.0,0.0
Petr Yan Lands Identical Left Hand on Cory Sandhagen &amp; Sean O’Malley,0,0,11,0,0,0,12,0.0,0.775,0.225,0.4939
Are there any draw that the fan base seems to agree on completely ?,0,2,4,1,1,0,14,0.0,0.696,0.304,0.5859
instant win,1,0,1,0,0,0,2,0.0,0.208,0.792,0.5859
I remember I wanted to be a UFC fighter then my friend sent me this,0,4,3,1,1,0,15,0.0,0.676,0.324,0.5859
anyone else feel like yair might just straight away ko emmet with a front kick to the face? chito frankie style,1,2,9,3,1,0,21,0.0,0.804,0.196,0.5267
This had me rolling. 😂,0,2,1,0,1,0,5,0.0,1.0,0.0,0.0
Should the UFC change to 2 15-minute round for title fight or main events?,3,0,5,0,0,0,14,0.184,0.816,0.0,-0.4019
Should the UFC change title fight to two 15-minute round instead of five 5-minute rounds?,2,0,6,1,0,1,15,0.162,0.838,0.0,-0.4019
"Why is everyone outside of T15 ""unranked""?",0,1,3,0,1,0,7,0.0,1.0,0.0,0.0
Daniel Cormier slam Dan Henderson and trip him right afterwards,1,2,5,0,0,0,10,0.0,1.0,0.0,0.0
"when i see a u/ThatGuysPenaMom or the generic ""thoughts?/facts?/opinions?"" r/ufc post",1,1,5,0,1,0,11,0.0,1.0,0.0,0.0
"Tsarukyan: ""It wa a prank bro..""",0,1,4,0,1,0,6,0.0,1.0,0.0,0.0
Walking into 2023 like,0,1,0,0,1,0,4,0.0,0.545,0.455,0.3612
‘2023 could get interesting’ - Former UFC champ Luke Rockhold tease return from retirement,1,2,8,0,0,0,14,0.135,0.675,0.19,0.2263
"how many former ufc LW champion (Edgar, Bendo, Alvarez, Oliveira, Pettis etc) can a prime Alexander Volkanovski beat prime for prime?",4,2,11,0,1,0,21,0.0,0.848,0.152,0.5267
mma|popmma|KO,0,0,1,0,0,1,1,0.0,1.0,0.0,0.0
UFC 285 - when will a main event be scheduled?,1,2,1,0,1,0,10,0.0,1.0,0.0,0.0
new single,2,0,0,0,0,1,2,0.0,1.0,0.0,0.0
Will they both fight wearing the black short with gold trims?,1,2,3,0,1,0,11,0.206,0.794,0.0,-0.3818
New to MMA,0,0,2,0,0,1,3,0.0,1.0,0.0,0.0
In their prime who wins?,0,1,1,0,1,0,5,0.0,0.519,0.481,0.5719
Pretty funny,1,0,0,1,1,0,2,0.0,0.0,1.0,0.7269
That chinese looking russian....most under the radar guy ever,1,1,3,1,1,0,9,0.0,1.0,0.0,0.0
Stop The Haymaker,0,1,1,0,0,0,3,0.524,0.476,0.0,-0.296
Im watching dustin v chandler again why doe dustin keep looking aside during fights?,0,4,6,2,1,0,14,0.172,0.828,0.0,-0.4019
Will there ever be another LHW a dominant a JJ was?,1,1,3,2,1,0,11,0.0,0.785,0.215,0.4084
Which fighter have the best jab in the game,2,1,3,0,1,0,9,0.097,0.565,0.339,0.6124
Since everyone else is making dumb posts. How much do you guy think Khabib can bench/squat/deadlift ? (At his walk around weight),2,8,4,1,1,0,22,0.142,0.858,0.0,-0.5106
Sherdog’s Top 10: Most Anticipated Fights of 2023,0,0,5,0,0,0,8,0.276,0.557,0.167,-0.2911
10-8 McKinney,1,0,1,0,1,0,2,0.0,1.0,0.0,0.0
I always think Dustin is funny af for acknowledging these kind of thing lol,1,4,4,1,1,0,14,0.0,0.659,0.341,0.6908
Robbing a brazilian jiu jitsu purple belt,1,1,4,0,0,0,7,0.0,1.0,0.0,0.0
"So let be real, greatest gatekeepers?",2,1,1,2,1,0,6,0.0,0.543,0.457,0.6369
Draftkings removing a lot of ufc stuff,1,1,3,0,1,0,7,0.0,1.0,0.0,0.0
Yahquinta Real Estate Ad,1,0,3,0,1,0,4,0.0,1.0,0.0,0.0
"Shogun Rua, The Brazilian Colby Covington (Translation in each image) Yeah, José Aldo is not the only alth-right Brazilian Fighter",4,1,10,1,1,0,20,0.0,0.826,0.174,0.4215
Which current male champion will lose their belt first?,1,1,4,0,1,0,9,0.199,0.515,0.287,0.296
A young Jorge Masvidal sucker slapping random guy on the street /s,2,1,6,0,1,0,12,0.254,0.746,0.0,-0.5267
woke up and felt like standing up for the integrity of our sport 🙏🫡💪😂,0,2,4,2,1,0,14,0.0,0.702,0.298,0.6249
10 UFC FIGHTS THAT NEED TO HAPPEN IN 2023,0,0,7,0,1,0,9,0.3,0.7,0.0,-0.5319
Best Jon Jones Moment of Greatness,0,0,5,0,1,0,6,0.0,0.543,0.457,0.6369
What is the sub's opinion on Manel Kape?,1,1,3,0,1,1,8,0.0,1.0,0.0,0.0
Matt Brown on Michael Chandler: ‘He chooses to be Arturo Gatti when he could be Floyd Mayweather’,0,3,9,0,1,0,17,0.0,1.0,0.0,0.0
UFC fight we need to see this year.,0,2,3,0,1,0,8,0.278,0.722,0.0,-0.4019
Conor ha had a rough start to this year...,1,2,3,0,1,0,9,0.0,1.0,0.0,0.0
CEO of Bellator MMA - Scott Coker: Khabib Nurmagomedov ‘freaking out’ over Bellator MMA vs. Rizin event,0,1,12,0,1,0,17,0.0,1.0,0.0,0.0
"Volkanovski on Makhachev fight, UFC 284 training camp, worst weight cut, Korean Zombie &amp; Holloway",3,0,10,0,0,0,15,0.423,0.577,0.0,-0.8316
WHERE WE STAND: UFC 2023 DIVISION-BY-DIVISION GUIDE,0,0,5,0,1,0,7,0.0,1.0,0.0,0.0
😂😂😂 Power of the first responder,2,0,2,0,1,0,6,0.0,1.0,0.0,0.0
Champions aren't always the best in their division,1,1,2,1,1,0,8,0.264,0.47,0.266,0.0083
Which fighter would you most like to see sing and dance in a musical?,2,1,3,1,1,0,14,0.0,0.715,0.285,0.5256
"Why doe ufc not upload of fight in their YouTube channel,why do they do “free fights”is it a money thing?",0,4,6,1,1,0,20,0.0,0.889,0.111,0.3089
Amateur Fighter need a nickname,1,1,2,0,1,1,5,0.0,0.652,0.348,0.1531
Question- I have 3 amateur fights. I need a nickname so I can promote myself- which one.,2,4,3,0,1,1,17,0.173,0.642,0.185,0.046
I have 3 amateur fights. I need a nickname so I can promote myself- which one.,2,4,2,0,0,1,16,0.185,0.617,0.197,0.046
"If the next world war broke out but all fighting wa one-on-one MMA rules, which country would have the strongest military per capita?",4,3,7,1,0,1,23,0.25,0.624,0.126,-0.4118
5 Things You Might Not Know About Manon Fiorot,0,1,3,1,0,0,9,0.0,1.0,0.0,0.0
Throwback to when Floyd Mayweather hinted coming to MMA,0,2,4,0,1,0,9,0.0,1.0,0.0,0.0
"Let's play a game, 2023 predictions. 2 point for every champ and 1 point for everything else.",0,1,8,0,1,0,17,0.0,0.686,0.314,0.6705
Haters,0,0,1,0,1,0,1,1.0,0.0,0.0,-0.4939
"2023 prediction (excuse spelling + ""Touch"" is my way of saying ""beat"")",0,3,6,0,1,0,12,0.0,1.0,0.0,0.0
"2023 prediction (Excuse spellings, did this quick)",0,1,3,0,1,0,7,0.0,1.0,0.0,0.0
Baddest fighter on the planet!,0,0,3,0,1,0,5,0.0,0.679,0.321,0.2244
Cro Cop Saves Two Abandoned Puppies,0,0,5,0,0,0,6,0.375,0.625,0.0,-0.4588
"UFC Fight Pass just got launched in Brazil with all live event for just R$149,40(28 US$) the anual signature.",2,2,8,2,1,0,19,0.123,0.806,0.071,-0.2732
Who would win? The guy with three ranked WWs on his resume or the guy whose sole ranked WW win is Masvidal?,1,4,7,0,1,0,22,0.0,0.715,0.285,0.8385
Whi is this gully to Khabib and why is he cry so hard? Was it a hard fight or because he feel honored?,1,5,5,2,1,0,23,0.32,0.556,0.124,-0.6114
Is this the wildest MMA record ever?,1,1,3,0,0,0,7,0.0,1.0,0.0,0.0
Looking for a fun SB,0,1,2,0,1,0,5,0.0,0.476,0.524,0.5106
hello everyone,0,0,2,0,1,0,2,0.0,1.0,0.0,0.0
Yair Rodriguez v Alex Volkanovski,0,0,5,0,0,1,5,0.0,1.0,0.0,0.0
That time Gonzaga gave Crocop a taste of his own medicine,1,1,5,0,0,0,11,0.0,1.0,0.0,0.0
"I can’t be the only one who doesn’t understand why so many people are calling this a close fight. Volk is my favorite fighter that’s active today but after seeing what Islam did to Charles, I think he’s gonna beat the piss out of Alex",6,13,10,1,1,0,45,0.113,0.779,0.108,-0.296
"[Official] General Discussion Thread - January 02, 2023",1,0,4,0,0,0,8,0.0,1.0,0.0,0.0
WWE Seth Rollins and Becky Lynch Get Standing Ovation From Crowd,0,1,8,0,0,0,11,0.0,1.0,0.0,0.0
Got my blue belt today! Time to retire 🥷🏼✌🏻,1,2,4,0,0,1,9,0.0,1.0,0.0,0.0
It's becoming increasingly clear that the UFC can afford 165 and 175 division,1,2,3,1,0,0,13,0.0,0.822,0.178,0.3818
Brand suggestions?,0,0,2,0,0,1,2,0.0,1.0,0.0,0.0
Ken Shamrock Lion's Den Tell All - Tony Galindo DEEPDIVE (ep. 141),0,1,9,0,0,0,12,0.0,1.0,0.0,0.0
Jake Paul &amp; The Schmo have a showdown,0,2,4,0,1,0,8,0.0,1.0,0.0,0.0
Me January 14th after week with no events.,0,0,4,0,1,0,8,0.239,0.761,0.0,-0.296
Anyone else miss the fight without crowds?,0,1,3,1,1,1,7,0.462,0.538,0.0,-0.5106
Wrestler to MMA,0,1,1,0,0,0,3,0.0,1.0,0.0,0.0
Anyone miss the pandemic fights?,1,1,2,0,1,1,5,0.589,0.411,0.0,-0.5106
UFC 284 Poster,0,0,1,0,0,0,3,0.0,1.0,0.0,0.0
EVERY BELLATOR MMA WORLD TITLE CHANGE OF 2022,0,0,5,0,0,0,8,0.0,1.0,0.0,0.0
"1. I wa thinking about something, a way to change the thing around weight cuts. What if it wa the case that the week out before a fight you had to be in a range of no more than 5-10 lb over the weight you were going to fight in. so for every week you had to make the weight range. What do you guy",2,16,11,3,1,0,65,0.144,0.856,0.0,-0.8225
Weight cut idea,0,0,3,0,1,1,3,0.524,0.476,0.0,-0.296
I love the UFC,0,1,1,0,1,0,4,0.0,0.323,0.677,0.6369
Dustin is awesome,1,1,1,0,1,1,3,0.0,0.328,0.672,0.6249
Wgat the fart is Dustin doing with his marriage,0,2,3,0,1,1,9,0.0,1.0,0.0,0.0
Anybody else upset?,1,0,1,1,1,0,3,0.565,0.435,0.0,-0.3818
Does Kelvin get cut if he loses to Imavov on the 14th? He would be 1-6 in his last 7 at that point,2,5,3,0,1,0,23,0.18,0.82,0.0,-0.5267
Top 5 MMA Fighters,1,0,2,0,0,0,4,0.3,0.25,0.45,0.1531
Bolsonaro Staying with Jose Aldo,0,1,3,0,0,1,5,0.0,1.0,0.0,0.0
What is going on with the heavyweight division?,0,2,2,0,0,0,8,0.0,1.0,0.0,0.0
MMA recommendation,0,0,2,0,0,0,2,0.0,1.0,0.0,0.0
Does Kelvin get cut if he loses to Imavov on the 14th? He would be 6-1 in his last 7 at that point,2,5,3,0,1,0,23,0.18,0.82,0.0,-0.5267
In their prime who would win? Max or Conor?,0,1,3,0,1,0,9,0.0,0.658,0.342,0.6322
Usman is not fighting on London March card,0,2,4,1,1,0,8,0.0,0.768,0.232,0.2755
Bolsonaro stay at José Aldo's mansion in the United States; see detail of the house,0,2,8,0,0,0,15,0.0,0.833,0.167,0.4215
"Kamaru usman seems to have a hand injury when he addressed the crowd at Face Off FN, wonderboy wa telling the truth",1,5,9,0,0,0,22,0.106,0.684,0.209,0.4019
UFC284 Official Poster,0,0,3,0,1,0,3,0.0,1.0,0.0,0.0
Omg. My heart skipped a beat for a second🤣,0,1,5,0,1,0,9,0.0,1.0,0.0,0.0
The UFC's graphic designer need to be fired,1,3,2,0,0,0,8,0.34,0.66,0.0,-0.5574
What an unfortunate looking poster,1,1,1,0,1,0,5,0.429,0.571,0.0,-0.4588
Official poster for UFC 284,1,0,2,0,0,0,5,0.0,1.0,0.0,0.0
Official poster #UFC284 (via @bigmarcel24),1,0,4,0,0,0,5,0.0,1.0,0.0,0.0
Dicko on TikTok,0,0,2,0,1,0,3,0.0,1.0,0.0,0.0
Unpopular Opinion!!!,1,0,1,0,1,0,2,0.0,1.0,0.0,0.0
What sport background could benefit MMA?,0,1,3,0,1,0,6,0.0,0.625,0.375,0.4588
"If Volk beat Islam, would it be the greatest ever win in term of boosting PFP greatness?",1,3,6,1,1,0,17,0.0,0.574,0.426,0.886
Legend,0,1,0,0,1,0,1,0.0,1.0,0.0,0.0
Casuals on Instagram are adamant that GSP maul Pereira within two rounds. Thoughts?,1,2,6,0,1,0,13,0.0,1.0,0.0,0.0
Creg Jones infiltrates Makachev’s camp to help shorten Volkanovski’s odds for UFC 284 in Perth,0,3,8,0,0,1,15,0.0,0.838,0.162,0.4019
MMA Artwork giveaway,0,0,3,0,0,0,3,0.0,1.0,0.0,0.0
Luke Rockhold Teases Potential 2023 Return To Fighting,0,1,5,0,0,0,8,0.439,0.561,0.0,-0.5719
GSP on dinosaur and woman,0,0,3,0,1,0,5,0.0,1.0,0.0,0.0
What fighter career will you have your kid watch in full in order when you introduce them to the UFC?,1,3,5,0,1,0,20,0.059,0.941,0.0,-0.0516
Thoughts on the oblique kick? Should it be banned?,1,2,2,0,1,0,9,0.296,0.704,0.0,-0.5204
Oh boy…thoughts on this move?,0,0,2,0,1,0,5,0.0,1.0,0.0,0.0
Which UFC fighter would you most likely turn to for emotional support?,2,0,4,1,1,0,12,0.0,0.604,0.396,0.5994
Was GSP really better than ever when he fought Bisping?,0,1,3,3,1,0,10,0.17,0.593,0.237,0.2247
Deiveson Figueiredo v Brandon Moreno 1 | FREE FIGHT | UFC 283,0,0,10,0,0,0,12,0.232,0.487,0.281,0.1779
"Prime Clay Guida v Jon Jones at 45, incredibly horny on gas station dick pill and coming off a real poor night of sleep (2-3 hour because of construction outside)?!?",4,1,15,2,1,0,30,0.207,0.793,0.0,-0.7936
End of 2023 Champion Predictions,0,0,3,0,1,0,5,0.0,0.506,0.494,0.5994
Will this affect The Perth card ??? Europe: Russia extends flight restriction at 10 southwestern airport and one airport in Crimea until at least Jan. 2 /update 101,2,2,12,0,1,0,28,0.0,0.927,0.073,0.2593
The Thrill of Victory and Agony of Defeat: Kim Soo Chul reacts to controversial loss to Juan Archuleta,1,1,10,0,0,0,18,0.39,0.512,0.098,-0.7506
FAST FORWARD TO JAN 1ST 2024… who is now champion?,1,1,3,2,1,0,10,0.0,0.698,0.302,0.5994
Real?,0,0,1,0,1,0,1,0.0,1.0,0.0,0.0
The Gracie hunter and the Gracie,0,0,3,0,1,0,6,0.0,1.0,0.0,0.0
Khabib playin both side 👀👀,0,2,2,0,1,0,5,0.0,1.0,0.0,0.0
Chito Vera Running Shoes?,0,0,4,0,1,0,4,0.0,1.0,0.0,0.0
Was anyone ever expecting Cowboy to beat Conor?,0,2,4,1,1,0,8,0.0,1.0,0.0,0.0
How I believe the championship matches/results will play out in 2023.,0,2,2,1,1,0,11,0.0,0.602,0.398,0.6486
How do you see this fight go down?? Technical and stipe go for grappling.,2,4,3,0,1,0,14,0.205,0.795,0.0,-0.5204
Smesh everybody bratha,0,0,3,0,1,0,3,0.0,1.0,0.0,0.0
Chael Drops a Nasty Line on Tito,0,0,5,0,1,0,7,0.419,0.581,0.0,-0.5574
I'm sorry but how the f... is that guy going to beat that guy,0,3,5,0,1,0,14,0.081,0.919,0.0,-0.0387
GSP on (not) sleeping before fight,0,1,3,0,1,0,6,0.351,0.649,0.0,-0.4019
Champ Prediction 2023 Part 3,0,0,3,0,1,0,5,0.0,0.492,0.508,0.4767
The Untold Story of Zabit Magomedsharipov,0,0,4,0,0,1,6,0.0,1.0,0.0,0.0
Moving to a new country. I'm giving away a bunch of MMA artwork if you can pick it up in NYC.,1,3,6,2,0,0,21,0.0,0.882,0.118,0.34
Given 2 of Aljamains title fight have been won through odd circumstance what’s the funniest way he can retain against Cejudo?,2,6,6,0,1,0,21,0.177,0.565,0.258,0.5106
johnny walker crazy air time,1,0,4,0,1,0,5,0.375,0.625,0.0,-0.34
Impressive performance by Khabib Nurmagomedov in Jumanji,1,0,4,0,1,0,7,0.0,0.645,0.355,0.5106
Damir Ismagulov Retires (Lightweight),0,0,4,0,1,0,4,0.0,1.0,0.0,0.0
"Styles make fights, so Khabib is lucky Islam is his best friend",2,3,5,1,1,0,12,0.128,0.378,0.494,0.83
Damir Ismagulov Retiring,0,1,2,0,1,0,3,0.0,1.0,0.0,0.0
Your weekly /r/MMA recap for the week of December 25 - December 31,1,0,5,0,0,1,13,0.0,1.0,0.0,0.0
"Damir Ismagulov retires from MMA due to health issues, wish him luck and to come back some day",2,3,6,1,1,0,18,0.0,0.737,0.263,0.6908
Leaked footage of Pat berry Training Teenage Rose Namajunas .,0,2,6,0,1,0,10,0.223,0.777,0.0,-0.3182
Emily Ratawskoijahusky portrait by me 🙌🖌️🫡,0,1,2,1,0,0,6,0.0,1.0,0.0,0.0
Has anyone noticed this on Wikipedia?,0,1,3,0,1,0,6,0.0,1.0,0.0,0.0
Damir Ismagulov announces his retirement via Instagram😢,0,1,4,0,0,0,7,0.0,1.0,0.0,0.0
What fighter did you go from hating to loving and which fighter did you go from loving to hating?,0,7,3,0,0,0,19,0.216,0.425,0.359,0.5267
Who here ha trained and what tip would you give someone who hasn't but love the sport and want to?,0,6,4,1,0,1,20,0.174,0.826,0.0,-0.612
Shortest to tallest UFC champions.,0,1,3,0,1,0,5,0.0,0.541,0.459,0.5267
"""I'm gonna beat you into the living death."" 💀💀",0,0,6,0,1,0,9,0.0,1.0,0.0,0.0
"If in this moment Jan inexplicably grabbed the mic and announced “I forfeit, he won”… before the final card wa read - would it change things? I know you can get DQ’d after the fight is over but before the official result are read - can you forfeit too?",4,11,9,2,1,0,49,0.046,0.954,0.0,-0.2869
"ONE HW/LHW Champion Anatoly Malykhin (12-0) shadow-realming his last three opponents, all win are finishes.",3,1,6,0,0,0,15,0.0,0.631,0.369,0.8225
ONE HW/LHW Champion Anatoly Malykhin (12-0) shadow-realming his last three opponent,2,0,6,0,0,0,11,0.0,0.719,0.281,0.5994
Luke Rockhold Gets Tired Then Shows His Beautiful Technique,1,1,5,1,0,0,9,0.21,0.507,0.283,0.25
UFC 4 worst soundtrack ever?,1,0,2,0,1,0,5,0.577,0.423,0.0,-0.6249
Chael say he’s up 7-4 on USADA scoreboard,0,2,3,1,1,0,8,0.0,1.0,0.0,0.0
How would this fight go?,0,0,2,0,1,0,5,0.429,0.571,0.0,-0.4588
Jalin Turner check Chito about weight cutting comments.,0,0,7,0,0,0,8,0.176,0.824,0.0,-0.128
@AnikFlorianPod: RT @SeanSheehanBA: The 2022 @SevereMMA commentator of the year is the one and only @Jon_Anik! https://t.co/mhaCWOqIm1 https://t.co/xWiN5gPIai,2,2,7,1,1,0,18,0.0,1.0,0.0,0.0
How I'm feeling going forward. I'm not taking shit from anybody this year.,1,3,5,1,0,0,13,0.0,0.713,0.287,0.5305
UFC FUN FACT!!,0,0,3,0,1,0,3,0.0,0.34,0.66,0.5972
Scariest Looking MMA Fighter?,0,1,3,0,0,0,4,0.0,0.652,0.348,0.1531
This Video On Charles Oliveira Will Change Your Life,0,0,7,0,0,0,9,0.0,1.0,0.0,0.0
THIS VIDEO ABOUT CHARLES OLIVEIRA WILL CHANGE YOUR LIFE,0,0,9,0,1,0,9,0.0,1.0,0.0,0.0
TIL Jose Aldo is a Bolsonaro supporter,0,1,5,0,1,0,7,0.0,0.704,0.296,0.2732
"What wa a call out or a scheduled fight that wa supposed to happen, but didn’t. That you were upset didn’t happen?",1,7,4,1,1,0,22,0.224,0.776,0.0,-0.6369
UFC 30th Anniversary Trailer,0,0,2,0,0,0,4,0.0,1.0,0.0,0.0
All of u in New Year’s Eve 2023 Be Like,0,0,4,0,1,0,10,0.0,0.783,0.217,0.3612
Khabibs face after every fight,0,0,3,0,1,0,5,0.394,0.606,0.0,-0.3818
What’s your guys’ opinion on glove touching?,1,0,3,0,1,0,7,0.0,1.0,0.0,0.0
"I'm most excited for what happens at 170 with this mf, any fighter you hope break into ranked spots?",1,4,4,1,1,0,19,0.053,0.702,0.245,0.659
Predicting Every UFC Champion in 2023!,0,1,3,0,1,0,6,0.0,0.544,0.456,0.636
Scott Coker say Bellator's 5-0 sweep over Rizin show his roster can hang with anyone – even UFC.,1,3,9,1,0,0,18,0.0,1.0,0.0,0.0
UFC star Paddy Pimblett share footage of fight with internet troll,0,0,9,0,0,0,11,0.188,0.652,0.159,-0.1027
What is the most fun mma fight to watch?,1,2,2,1,0,1,9,0.213,0.52,0.267,0.1851
Interesting guest at Jose Aldo's house,0,1,4,0,0,0,6,0.0,0.649,0.351,0.4019
MMA prediction thread of 2023,0,0,3,0,0,0,5,0.0,1.0,0.0,0.0
volk bulking for LW,0,1,2,0,1,0,4,0.0,1.0,0.0,0.0
Dustin Porier’s Hot Sauce Review (w/killer Creole Maple),0,0,8,0,0,0,8,0.0,1.0,0.0,0.0
ALJAMAIN STERLING VS MAX HALLOWAY,0,0,5,0,1,0,5,0.0,1.0,0.0,0.0
No UFC event until Jan 14th...,0,0,3,0,1,0,6,0.306,0.694,0.0,-0.296
fitness and mma related YouTube channel in India?,0,1,5,0,0,1,8,0.0,0.769,0.231,0.2732
"Potentially Ending a 11-Fight-UFC winstreak (Oliveira), a 12 fight UFC winstreak (Volk) and a 9 fight ufc winstreak (Dariush) Consecutively is the stuff of legend",2,3,11,1,1,0,25,0.215,0.785,0.0,-0.6369
Better get the popcorn folk gonna be a banger however I really wish it wa a 5 rounder.,1,5,3,3,1,0,18,0.0,0.671,0.329,0.7089
"So if Colby make a return in 2023, who's he gonna fight Usman Trilogy Belal Muhammad Leon Edwards? Shavkat? Khamzat?",1,2,11,1,1,0,20,0.149,0.851,0.0,-0.4836
Aljamain Sterling Responds To Chito Vera's Weight Bully Accusations,0,0,8,0,0,0,9,0.44,0.56,0.0,-0.6705
How is supposed to act an MMA fighter if attacked by an average person?,1,4,3,0,0,1,14,0.181,0.723,0.096,-0.34
Israel Adesanya not regretting 2022,0,1,2,1,0,0,5,0.0,0.639,0.361,0.3089
worst champion in each ufc division history,2,0,3,0,1,0,7,0.328,0.4,0.272,-0.1779
Eddie Alvarez v Ching Chang Chong in the work for ONE FC 69,0,0,7,0,1,0,13,0.0,1.0,0.0,0.0
Happy new year everyone,2,0,2,0,1,0,4,0.0,0.448,0.552,0.5719
who are some of the worst UFC Champions of all time?,2,1,2,0,1,0,11,0.248,0.545,0.206,-0.1779
"Have you been banned from any MMA sub reddits? If so, why?",1,3,4,0,1,0,12,0.234,0.766,0.0,-0.5204
"unpopular opinion: Maybe other than Eddie Alvarez (worst UFC champion of all time) there no other ufc LW champion this man beat in their primes. Prime Oliveira, Makh, Khabib, McGregor, RDA, Pettis, Bendo all beat the shit out of Prime Soyrier im afraid",5,2,24,1,1,0,43,0.042,0.736,0.223,0.891
How doe Volk beat Islam at 284?,0,2,2,0,0,1,7,0.0,1.0,0.0,0.0
Retired life is a good life,1,1,3,0,1,0,6,0.0,0.58,0.42,0.4404
cut at 145 wa absolutely crazy,1,1,1,1,1,0,6,0.545,0.455,0.0,-0.5849
will UFC this year be better year than 2022 and why?,1,3,2,0,1,0,11,0.0,0.775,0.225,0.4404
How Do These M'Fu*kers Get These Ninja Turtle Backs?,0,0,6,0,1,0,9,0.13,0.87,0.0,-0.0516
Gracie x Nurmagamedov,0,0,3,0,1,0,3,0.0,1.0,0.0,0.0
MMA prediction for 2023.,0,0,2,0,1,0,4,0.0,1.0,0.0,0.0
Can anybody help we with a presale code for UFC 286 London?,0,2,4,0,1,0,12,0.0,0.787,0.213,0.4019
2023 MMA Prediction Thread,0,0,3,0,0,1,4,0.0,1.0,0.0,0.0
"[Official] General Discussion Thread - January 01, 2023",1,0,4,0,0,0,8,0.0,1.0,0.0,0.0
How do y’all feel about this.,0,2,1,0,1,1,6,0.0,1.0,0.0,0.0
Coach Khabib every time in the corner,0,0,4,0,1,0,7,0.0,1.0,0.0,0.0
Help me watch every ufc fight.,0,2,2,0,1,0,6,0.28,0.43,0.29,0.0258
Can someone lend me $30 until next week?,2,1,2,0,1,0,8,0.0,1.0,0.0,0.0
UFC Pandemic Victory Lap Hype Video,0,0,6,0,1,1,6,0.0,1.0,0.0,0.0
Champ Prediction 2023 Continued,0,1,2,0,1,0,4,0.0,0.492,0.508,0.4767
Where’s Dan hardy gone?,0,0,4,0,1,0,4,0.0,0.526,0.474,0.4019
Is Francis over valuing himself or making the right decision in his contract negotiations? Hopefully we will see him back next year so Jones can knock his big as out.,3,5,8,3,1,0,30,0.098,0.758,0.143,0.1531
McGregors BJJ game is underestimated,1,1,3,0,1,0,5,0.344,0.656,0.0,-0.2732
first spar in a month,0,0,2,1,0,0,5,0.0,1.0,0.0,0.0
What 2022 UFC opinion got you like this?,0,1,3,0,1,0,8,0.0,0.737,0.263,0.3612
How different would the sport be if you were allowed service dog in the octagon,1,3,4,0,1,0,15,0.0,1.0,0.0,0.0
An oldie but a goodie from https://instagram.com/rob_lane_edits?igshid=YmMyMTA2M2Y=,0,0,3,0,1,0,7,0.0,1.0,0.0,0.0
What if Adesanya loss to Pereira again,1,0,2,1,1,0,7,0.31,0.69,0.0,-0.4019
happy new year all,2,0,1,0,1,0,4,0.0,0.448,0.552,0.5719
@AnikFlorianPod: RT @fightnightpicks: 2022 #MMA Podcast of the Year 🏆 Nominees - The @ringer MMA Show - @chaddundas &amp; @benfowlkesMMA - @aaronbronsteter &amp; @BazookaJoeV - @AnikFlorianPod - @ThePYNPodcast Full Show ⬇️ 📺 https://t.co/7RHbC8zBCt https://t.co/eJpkpqllyw,3,0,20,0,1,0,34,0.0,1.0,0.0,0.0
How confident are we?,2,1,0,0,1,0,4,0.0,0.484,0.516,0.4939
Fury Pro Grappling 6 Rose Namajunas post-fight interview,1,1,5,0,0,0,8,0.381,0.619,0.0,-0.5719
Does usada pick up on picograms?,0,2,2,1,1,0,6,0.0,1.0,0.0,0.0
What 5 rounder do you think will be a war next year?,1,3,3,0,1,0,12,0.302,0.698,0.0,-0.5994
Can someone please translate this from shavkats story it’s eating me up thank you 🙏,1,4,4,0,1,0,15,0.0,0.714,0.286,0.5859
The Unknown Men Behind UFC's Controversial Rise,0,0,6,0,0,0,7,0.231,0.769,0.0,-0.2023
Inbred Muslim mentality,0,0,3,0,1,0,3,0.0,1.0,0.0,0.0
Why is Jiri Prochazka being tested so much by Usada ?,1,3,3,1,0,1,11,0.0,1.0,0.0,0.0
284 Press Conference,0,0,2,0,1,1,3,0.0,1.0,0.0,0.0
Happy New Year fight fan 🎆,1,1,4,0,1,0,6,0.28,0.323,0.398,0.2732
Rooting for Burns. Would like to see him fight someone in the top 5 if he wins…Or Masvidal,1,4,4,0,1,0,18,0.124,0.67,0.206,0.1779
Best promotion,1,0,1,0,0,1,2,0.0,0.192,0.808,0.6369
Muhammad Ali faked Parkinson’s,0,1,3,0,0,1,4,0.0,1.0,0.0,0.0
Accurate,0,0,1,0,1,0,1,0.0,1.0,0.0,0.0
Random Question,0,0,2,0,1,0,2,0.0,1.0,0.0,0.0
[SPOILER] Cage Warriors 148: Modestas Bukauskas vs. Chuck Campbell,1,0,6,0,0,0,9,0.0,1.0,0.0,0.0
Rare Picture of Khabib's wife when not covered by a towel,1,1,4,1,1,0,11,0.0,1.0,0.0,0.0
is UFC 4 on xbox one any good?,1,1,2,0,1,0,8,0.0,0.674,0.326,0.4404
Who ha the best chance of beating edward,1,1,3,0,1,1,8,0.211,0.352,0.437,0.4939
